hash,source,title,description,content,published_at,url,language,tickers,raw
1683dfac4a0e642991735c390420a8129825abf1dc00feb738ec36ca4bce6dc0,BleepingComputer,Trojan Virus from Emulator software,"Trojan Virus from Emulator software - posted in Virus, Trojan, Spyware, and Malware Removal Help: Hi guys
 
I recently downloaded emulator software and it seems to have infected my pc with a Trojan virus. I have done a scan and removal with the following in o…","Hi guys
I recently downloaded emulator software and it seems to have infected my pc with a Trojan virus. I have done a scan and removal with the following in order:
Malwarebytes anti-malware
Windo… [+173984 chars]",2026-04-22 11:22:20+00:00,https://www.bleepingcomputer.com/forums/t/815614/trojan-virus-from-emulator-software/,en,[],"{'source': {'id': None, 'name': 'BleepingComputer'}, 'author': 'SpiTaFeX', 'title': 'Trojan Virus from Emulator software', 'description': 'Trojan Virus from Emulator software - posted in Virus, Trojan, Spyware, and Malware Removal Help: Hi guys\n\xa0\nI recently downloaded emulator software and it seems to have infected my pc with a Trojan virus. I have done a scan and removal with the following in o…', 'url': 'https://www.bleepingcomputer.com/forums/t/815614/trojan-virus-from-emulator-software/', 'urlToImage': 'https://www.bleepingcomputer.com/forums/public/style_images/master/meta_image.png', 'publishedAt': '2026-04-22T11:22:20Z', 'content': 'Hi guys\r\nI recently downloaded emulator software and it seems to have infected my pc with a Trojan virus. I have done a scan and removal with the following in order:\r\nMalwarebytes anti-malware\r\nWindo… [+173984 chars]'}"
7bb93413d51cfce6b8784791c26b3d07d40782cf0980157258832fd970a8e0f8,Www.gov.uk,"Accredited official statistics: Exposure to lead in Great Britain, 2025",Annual summary of medical surveillance of blood-lead levels in British workers up to March 2025.,"We use some essential cookies to make this website work.
Wed like to set additional cookies to understand how you use GOV.UK, remember your settings and improve government services.
We also use coo… [+70 chars]",2026-04-22 11:22:05+00:00,https://www.gov.uk/government/statistics/announcements/exposure-to-lead-in-great-britain-2025,en,[],"{'source': {'id': None, 'name': 'Www.gov.uk'}, 'author': None, 'title': 'Accredited official statistics: Exposure to lead in Great Britain, 2025', 'description': 'Annual summary of medical surveillance of blood-lead levels in British workers up to March 2025.', 'url': 'https://www.gov.uk/government/statistics/announcements/exposure-to-lead-in-great-britain-2025', 'urlToImage': 'https://www.gov.uk/assets/frontend/govuk-opengraph-image-4196a4d6333cf92aaf720047f56cfd91b3532d7635fc21ebcf0d5897df6b5f77.png', 'publishedAt': '2026-04-22T11:22:05Z', 'content': 'We use some essential cookies to make this website work.\r\nWed like to set additional cookies to understand how you use GOV.UK, remember your settings and improve government services.\r\nWe also use coo… [+70 chars]'}"
48858d4836be3302e2ea745fc72cb44f980bf20e26e8ce5102a665391a848937,Yahoo Entertainment,England's adaptive cheerleading champions chasing gold in Florida,England's Adaptive Abilities Advanced cheerleading team on growing participation and medal hopes,"If you click 'Accept all', we and our partners, including 250 who are part of the IAB Transparency &amp; Consent Framework, will also store and / or access information on a device (in other words, us… [+1046 chars]",2026-04-22 11:21:41+00:00,https://consent.yahoo.com/v2/collectConsent?sessionId=1_cc-session_9c70ecf6-363f-44d6-ad6c-f280d03070b7,en,[],"{'source': {'id': None, 'name': 'Yahoo Entertainment'}, 'author': None, 'title': ""England's adaptive cheerleading champions chasing gold in Florida"", 'description': ""England's Adaptive Abilities Advanced cheerleading team on growing participation and medal hopes"", 'url': 'https://consent.yahoo.com/v2/collectConsent?sessionId=1_cc-session_9c70ecf6-363f-44d6-ad6c-f280d03070b7', 'urlToImage': None, 'publishedAt': '2026-04-22T11:21:41Z', 'content': ""If you click 'Accept all', we and our partners, including 250 who are part of the IAB Transparency &amp; Consent Framework, will also store and / or access information on a device (in other words, us… [+1046 chars]""}"
c1c29257e72d71971fc1f1501ca2f0d9e75fce97a035382f4417915381591da4,iPhone in Canada,Apple Launches Tap to Pay on iPhone in Malaysia,"Apple's Tap to Pay on iPhone is now rolling out to users in Malaysia, allowing buisnesses to set up the contactless payment system.
The post Apple Launches Tap to Pay on iPhone in Malaysia first appeared on iPhone in Canada.","Apple’s Tap to Pay on iPhone is now rolling out to users in Malaysia. Starting today, independent store owners and sellers, as well as larger retailers in the region, can securely accept in-person co… [+1497 chars]",2026-04-22 11:21:34+00:00,https://www.iphoneincanada.ca/2026/04/22/apple-tap-to-pay-on-iphone-malaysia/,en,[],"{'source': {'id': None, 'name': 'iPhone in Canada'}, 'author': 'Steve Vegvari', 'title': 'Apple Launches Tap to Pay on iPhone in Malaysia', 'description': ""Apple's Tap to Pay on iPhone is now rolling out to users in Malaysia, allowing buisnesses to set up the contactless payment system.\nThe post Apple Launches Tap to Pay on iPhone in Malaysia first appeared on iPhone in Canada."", 'url': 'https://www.iphoneincanada.ca/2026/04/22/apple-tap-to-pay-on-iphone-malaysia/', 'urlToImage': 'https://cdn.iphoneincanada.ca/wp-content/uploads/2023/07/Apple-Tap-to-Pay.jpg', 'publishedAt': '2026-04-22T11:21:34Z', 'content': 'Apple’s Tap to Pay on iPhone is now rolling out to users in Malaysia. Starting today, independent store owners and sellers, as well as larger retailers in the region, can securely accept in-person co… [+1497 chars]'}"
ce35eed15a1f3cca78c53d650a9855dce686a5681308fdf635351a8627dc6a2a,Seroundtable.com,Google Ads AI-Qualified Call Conversions,Google Ads has a new help document on AI-Qualified Call Conversions.  Google says AI-qualified call leads use Google AI to evaluate call recordings to determine the actual quality of the conversation.,Google Ads has a new help document on AI-Qualified Call Conversions. Google says AI-qualified call leads use Google AI to evaluate call recordings to determine the actual quality of the conversation.… [+1236 chars],2026-04-22 11:21:23+00:00,https://www.seroundtable.com/google-ads-ai-qualified-call-conversions-41193.html,en,[],"{'source': {'id': None, 'name': 'Seroundtable.com'}, 'author': 'Barry Schwartz', 'title': 'Google Ads AI-Qualified Call Conversions', 'description': 'Google Ads has a new help document on AI-Qualified Call Conversions.  Google says AI-qualified call leads use Google AI to evaluate call recordings to determine the actual quality of the conversation.', 'url': 'https://www.seroundtable.com/google-ads-ai-qualified-call-conversions-41193.html', 'urlToImage': 'https://images.seroundtable.com/broken-google-phone-1759508384.jpg', 'publishedAt': '2026-04-22T11:21:23Z', 'content': 'Google Ads has a new help document on AI-Qualified Call Conversions. Google says AI-qualified call leads use Google AI to evaluate call recordings to determine the actual quality of the conversation.… [+1236 chars]'}"
07b9637af713f11cb561ee069114f21cf3062e5d2f9b8d46b5086a39a62a9b9f,Yahoo Entertainment,"Best Buy names Jason Bonfig as next CEO, replacing Corie Barry",,"If you click 'Accept all', we and our partners, including 250 who are part of the IAB Transparency &amp; Consent Framework, will also store and / or access information on a device (in other words, us… [+1046 chars]",2026-04-22 11:21:21+00:00,https://consent.yahoo.com/v2/collectConsent?sessionId=1_cc-session_7efe5a2d-733d-4e2a-af90-327f9273c209,en,[],"{'source': {'id': None, 'name': 'Yahoo Entertainment'}, 'author': None, 'title': 'Best Buy names Jason Bonfig as next CEO, replacing Corie Barry', 'description': None, 'url': 'https://consent.yahoo.com/v2/collectConsent?sessionId=1_cc-session_7efe5a2d-733d-4e2a-af90-327f9273c209', 'urlToImage': None, 'publishedAt': '2026-04-22T11:21:21Z', 'content': ""If you click 'Accept all', we and our partners, including 250 who are part of the IAB Transparency &amp; Consent Framework, will also store and / or access information on a device (in other words, us… [+1046 chars]""}"
2b5019a2d1c2ce643292fba21cd50cb49e7482f3ba58df310165ccad2d4513b0,CNA,"Singapore, Malaysia and Indonesia 'strategically aligned' in keeping Strait of Malacca open: Vivian Balakrishnan","""We do not have tolls. All of us are trade-dependent economies. All of us know it is in our interest to keep it open,"" Dr Balakrishnan said in an interview with CNBC.","On whether there may be a time when the US or China would exert more pressure on nations like Singapore, the minister replied: ""Not yet, for us.""
He added that when Singapore engages with the US, he… [+1128 chars]",2026-04-22 11:21:00+00:00,https://www.channelnewsasia.com/singapore/strait-malacca-open-indonesia-malaysia-vivian-balakrishnan-6073151,en,[],"{'source': {'id': None, 'name': 'CNA'}, 'author': None, 'title': ""Singapore, Malaysia and Indonesia 'strategically aligned' in keeping Strait of Malacca open: Vivian Balakrishnan"", 'description': '""We do not have tolls. All of us are trade-dependent economies. All of us know it is in our interest to keep it open,"" Dr Balakrishnan said in an interview with CNBC.', 'url': 'https://www.channelnewsasia.com/singapore/strait-malacca-open-indonesia-malaysia-vivian-balakrishnan-6073151', 'urlToImage': 'https://dam.mediacorp.sg/image/upload/s--i_V-xbaV--/c_crop,h_270,w_480,x_0,y_0/c_fill,g_auto,h_676,w_1200/f_auto,q_auto/v1/mediacorp/cna/image/2026/04/22/image_480.png?itok=EB_EO47S', 'publishedAt': '2026-04-22T11:21:00Z', 'content': 'On whether there may be a time when the US or China would exert more pressure on nations like Singapore, the minister replied: ""Not yet, for us.""\r\nHe added that when Singapore engages with the US, he… [+1128 chars]'}"
151b68ec7d3c822a4814158e9fb5655cfeb0f901996f5f24a3b528b3f48eec15,CNA,"Singapore, Malaysia and Indonesia 'strategically aligned' in keeping Straits of Malacca open: Vivian Balakrishnan","<![CDATA[ ""We do not have tolls. All of us are trade-dependent economies. All of us know it is in our interest to keep it open,"" Dr Balakrishnan said in an interview with CNBC. ]]>","On whether there may be a time when the US or China would exert more pressure on nations like Singapore, the minister replied: ""Not yet, for us.""
He added that when Singapore engages with the US, he… [+1128 chars]",2026-04-22 11:21:00+00:00,https://www.channelnewsasia.com/singapore/straits-malacca-open-indonesia-malaysia-vivian-balakrishnan-6073151,en,[],"{'source': {'id': None, 'name': 'CNA'}, 'author': None, 'title': ""Singapore, Malaysia and Indonesia 'strategically aligned' in keeping Straits of Malacca open: Vivian Balakrishnan"", 'description': '<![CDATA[ ""We do not have tolls. All of us are trade-dependent economies. All of us know it is in our interest to keep it open,"" Dr Balakrishnan said in an interview with CNBC. ]]>', 'url': 'https://www.channelnewsasia.com/singapore/straits-malacca-open-indonesia-malaysia-vivian-balakrishnan-6073151', 'urlToImage': 'https://dam.mediacorp.sg/image/upload/s--i_V-xbaV--/c_crop,h_270,w_480,x_0,y_0/c_fill,g_auto,h_676,w_1200/f_auto,q_auto/v1/mediacorp/cna/image/2026/04/22/image_480.png?itok=EB_EO47S', 'publishedAt': '2026-04-22T11:21:00Z', 'content': 'On whether there may be a time when the US or China would exert more pressure on nations like Singapore, the minister replied: ""Not yet, for us.""\r\nHe added that when Singapore engages with the US, he… [+1128 chars]'}"
9aec9116911f8b5989d81120495662fe198f91e35512f1ed6cc76e829b2093c9,Yahoo Entertainment,ADNIC secures India approval for GIFT City reinsurance branch,,"If you click 'Accept all', we and our partners, including 250 who are part of the IAB Transparency &amp; Consent Framework, will also store and / or access information on a device (in other words, us… [+1046 chars]",2026-04-22 11:20:57+00:00,https://consent.yahoo.com/v2/collectConsent?sessionId=1_cc-session_72fe1093-c309-464b-a3e9-3a31589579f4,en,[],"{'source': {'id': None, 'name': 'Yahoo Entertainment'}, 'author': None, 'title': 'ADNIC secures India approval for GIFT City reinsurance branch', 'description': None, 'url': 'https://consent.yahoo.com/v2/collectConsent?sessionId=1_cc-session_72fe1093-c309-464b-a3e9-3a31589579f4', 'urlToImage': None, 'publishedAt': '2026-04-22T11:20:57Z', 'content': ""If you click 'Accept all', we and our partners, including 250 who are part of the IAB Transparency &amp; Consent Framework, will also store and / or access information on a device (in other words, us… [+1046 chars]""}"
578200611b1194f0fb4fef8d5dc0ae1713569a28ab2022d8298f894a87196237,Packaging-gateway.com,Sonoco Q1 2026 profit rises despite dip in sales,"Net sales for the quarter came in at $1.7bn, marking a year-on-year decrease of 1.9%.","Sonoco has posted first-quarter attributable net income of $67.6m, compared with $54.4m in the same quarter of 2025.
Diluted earnings per share attributable to Sonoco increased to $0.68 from $0.55 a… [+3140 chars]",2026-04-22 11:19:31+00:00,https://www.packaging-gateway.com/news/sonoco-q1-2026-profit-rises/,en,[],"{'source': {'id': None, 'name': 'Packaging-gateway.com'}, 'author': 'Vidhya Edwards Munnangi', 'title': 'Sonoco Q1 2026 profit rises despite dip in sales', 'description': 'Net sales for the quarter came in at $1.7bn, marking a year-on-year decrease of 1.9%.', 'url': 'https://www.packaging-gateway.com/news/sonoco-q1-2026-profit-rises/', 'urlToImage': 'https://s.yimg.com/ny/api/res/1.2/lMeN98A7BQ7OTHGY5Z218A--/YXBwaWQ9aGlnaGxhbmRlcjt3PTEyMDA7aD02NzU-/https://media.zenfs.com/en/packaging_gateway_559/57de6ef06b17c8352a4089b0f14b8902', 'publishedAt': '2026-04-22T11:19:31Z', 'content': 'Sonoco has posted first-quarter attributable net income of $67.6m, compared with $54.4m in the same quarter of 2025.\r\nDiluted earnings per share attributable to Sonoco increased to $0.68 from $0.55 a… [+3140 chars]'}"
f947887cc81e594ee0c2e4015844364829f87ddc19ee4f69ecb009ecd75244bb,Business Insider,SpaceX's IPO could be a real problem for Tesla,"Tesla reports earnings today, but investors' eyes might ultimately be on another one of Elon Musk's prizes.","Elon Musk's other company reports earnings today.
That's a funny way to describe a $1.2 trillion company, but Tesla's increasingly feeling like it's playing second fiddle to SpaceX.
Musk's space co… [+1987 chars]",2026-04-22 11:19:07+00:00,https://www.businessinsider.com/spacexs-ipo-could-be-a-real-problem-for-tesla-2026-4,en,[],"{'source': {'id': 'business-insider', 'name': 'Business Insider'}, 'author': 'ddefrancesco@businessinsider.com (Dan DeFrancesco)', 'title': ""SpaceX's IPO could be a real problem for Tesla"", 'description': ""Tesla reports earnings today, but investors' eyes might ultimately be on another one of Elon Musk's prizes."", 'url': 'https://www.businessinsider.com/spacexs-ipo-could-be-a-real-problem-for-tesla-2026-4', 'urlToImage': 'https://i.insider.com/69e7dbdb367066d7c296f4d2?width=1200&format=jpeg', 'publishedAt': '2026-04-22T11:19:07Z', 'content': ""Elon Musk's other company reports earnings today.\r\nThat's a funny way to describe a $1.2 trillion company, but Tesla's increasingly feeling like it's playing second fiddle to SpaceX.\r\nMusk's space co… [+1987 chars]""}"
cb3e9d3f22cfb7bfee841e86cb609622ed438c32859a1af6d2886f91e10d52cd,Yahoo Entertainment,Are consumers finally cracking under the weight of $4 gas?,,"If you click 'Accept all', we and our partners, including 250 who are part of the IAB Transparency &amp; Consent Framework, will also store and / or access information on a device (in other words, us… [+1046 chars]",2026-04-22 11:18:59+00:00,https://consent.yahoo.com/v2/collectConsent?sessionId=1_cc-session_e773da5b-53bb-4c67-8292-d5101d463a7b,en,[],"{'source': {'id': None, 'name': 'Yahoo Entertainment'}, 'author': None, 'title': 'Are consumers finally cracking under the weight of $4 gas?', 'description': None, 'url': 'https://consent.yahoo.com/v2/collectConsent?sessionId=1_cc-session_e773da5b-53bb-4c67-8292-d5101d463a7b', 'urlToImage': None, 'publishedAt': '2026-04-22T11:18:59Z', 'content': ""If you click 'Accept all', we and our partners, including 250 who are part of the IAB Transparency &amp; Consent Framework, will also store and / or access information on a device (in other words, us… [+1046 chars]""}"
42f6bc90d5339ad0466feae325a1b47dc28103473b10797ea78281f68a5712d3,Yahoo Entertainment,"Gold and silver prices today, Wednesday, April 22: Prices open at their lowest levels in a week",,"If you click 'Accept all', we and our partners, including 250 who are part of the IAB Transparency &amp; Consent Framework, will also store and / or access information on a device (in other words, us… [+1046 chars]",2026-04-22 11:18:56+00:00,https://consent.yahoo.com/v2/collectConsent?sessionId=1_cc-session_6a9deea4-1456-4e50-b6f7-28e3c61a5d8c,en,[],"{'source': {'id': None, 'name': 'Yahoo Entertainment'}, 'author': None, 'title': 'Gold and silver prices today, Wednesday, April 22: Prices open at their lowest levels in a week', 'description': None, 'url': 'https://consent.yahoo.com/v2/collectConsent?sessionId=1_cc-session_6a9deea4-1456-4e50-b6f7-28e3c61a5d8c', 'urlToImage': None, 'publishedAt': '2026-04-22T11:18:56Z', 'content': ""If you click 'Accept all', we and our partners, including 250 who are part of the IAB Transparency &amp; Consent Framework, will also store and / or access information on a device (in other words, us… [+1046 chars]""}"
fb218ff08003fc6f75b2b59daa5a1955133da706b16ad67be40fd793b9588187,Forbes,Elevance Health Profits Eclipse $1.7 Billion Despite Elevated Costs,Elevance Health reported $1.7 billion in first quarter net income as cost issues continued to drag on earnings of the nation’s second-largest health insurer.,Elevance Health Wednesday reported first quarter net income exceeding $1.7 billion as healthcare cost issues continued to be a drag on earnings of the nations second-largest health insurance company.… [+3585 chars],2026-04-22 11:17:06+00:00,https://www.forbes.com/sites/brucejapsen/2026/04/22/elevance-health-profits-eclipse-17-billion-despite-elevated-costs/,en,[],"{'source': {'id': None, 'name': 'Forbes'}, 'author': 'Bruce Japsen, Senior Contributor, \n Bruce Japsen, Senior Contributor\n https://www.forbes.com/sites/brucejapsen/', 'title': 'Elevance Health Profits Eclipse $1.7 Billion Despite Elevated Costs', 'description': 'Elevance Health reported $1.7 billion in first quarter net income as cost issues continued to drag on earnings of the nation’s second-largest health insurer.', 'url': 'https://www.forbes.com/sites/brucejapsen/2026/04/22/elevance-health-profits-eclipse-17-billion-despite-elevated-costs/', 'urlToImage': 'https://imageio.forbes.com/specials-images/imageserve/634fd98138f2f6f4c4c9a291/0x0.jpg?format=jpg&height=900&width=1600&fit=bounds', 'publishedAt': '2026-04-22T11:17:06Z', 'content': 'Elevance Health Wednesday reported first quarter net income exceeding $1.7 billion as healthcare cost issues continued to be a drag on earnings of the nations second-largest health insurance company.… [+3585 chars]'}"
ebdc9720f63675d528d80d1c13eb383a2063579902eab9a1915afb1fc657c3e2,BGR,5 Cool Gadgets Under $30 That Work With Your iPhone,"These cheap iPhone gadgets cover a range of needs - photography, tracking, charging, and waterproofing - and they all have strong reviews to back them up.","Virtually every new iPhone release has Apple touting improvements to the battery, but keeping a solid charging cable handy is never a bad idea. We're no strangers to charging accessories, and we can … [+1290 chars]",2026-04-22 11:17:00+00:00,https://www.bgr.com/2149487/cool-gadgets-under-30-that-work-with-iphone/,en,[],"{'source': {'id': None, 'name': 'BGR'}, 'author': 'staff@bgr.com (Nichols deCourville)', 'title': '5 Cool Gadgets Under $30 That Work With Your iPhone', 'description': 'These cheap iPhone gadgets cover a range of needs - photography, tracking, charging, and waterproofing - and they all have strong reviews to back them up.', 'url': 'https://www.bgr.com/2149487/cool-gadgets-under-30-that-work-with-iphone/', 'urlToImage': 'https://www.bgr.com/img/gallery/5-cool-gadgets-under-30-that-work-with-your-iphone/l-intro-1776294865.jpg', 'publishedAt': '2026-04-22T11:17:00Z', 'content': ""Virtually every new iPhone release has Apple touting improvements to the battery, but keeping a solid charging cable handy is never a bad idea. We're no strangers to charging accessories, and we can … [+1290 chars]""}"
5a6e8d83dbac978a442478ab53a17855a46f26f3c1b73633a32bb381bf828b72,Financial Post,Pecoy Copper Completes Magnetotelluric Survey to Optimize High-Priority Targeting and Resource Expansion,"VANCOUVER, British Columbia, April 22, 2026 (GLOBE NEWSWIRE) — Pecoy Copper Corp. (“Pecoy Copper” or the “Company”) (TSXV: PCU; FSE: D5E; OTCQB: PCUUF) is pleased to announce the completion of a large-scale magnetotelluric (“MT”) geophysical survey at its 100…","The Companys common shares are listed on the TSX Venture under the symbol PCU and also trade on the OTCQB under the symbol PCUUF.
For further information, please contact:
Vincent Metcalfe, Presiden… [+3015 chars]",2026-04-22 11:16:06+00:00,https://financialpost.com/globe-newswire/pecoy-copper-completes-magnetotelluric-survey-to-optimize-high-priority-targeting-and-resource-expansion,en,[],"{'source': {'id': 'financial-post', 'name': 'Financial Post'}, 'author': 'GlobeNewswire', 'title': 'Pecoy Copper Completes Magnetotelluric Survey to Optimize High-Priority Targeting and Resource Expansion', 'description': 'VANCOUVER, British Columbia, April 22, 2026 (GLOBE NEWSWIRE) — Pecoy Copper Corp.\xa0(“Pecoy Copper” or the “Company”) (TSXV: PCU; FSE: D5E; OTCQB: PCUUF) is pleased to announce the completion of a large-scale magnetotelluric (“MT”) geophysical survey at its 100…', 'url': 'https://financialpost.com/globe-newswire/pecoy-copper-completes-magnetotelluric-survey-to-optimize-high-priority-targeting-and-resource-expansion', 'urlToImage': 'https://smartcdn.gprod.postmedia.digital/financialpost/wp-content/uploads/2026/04/figure-1-deep-spartan-mt-survey-grid.jpeg', 'publishedAt': '2026-04-22T11:16:06Z', 'content': 'The Companys common shares are listed on the TSX Venture under the symbol PCU and also trade on the OTCQB under the symbol PCUUF.\r\nFor further information, please contact:\r\nVincent Metcalfe, Presiden… [+3015 chars]'}"
5e878a7b90becebedf0d685de55ac64ffefa24b146e0134bb515cfb010acf549,CNET,Apple Watch Series 11 vs. Series 10: How These Nearly Identical Watches Compare,"You might think Apple forgot to improve its latest flagship Apple Watch, but there are some differences from last year's model.","The Apple Watch Ultra 3 is distinctive in shape and features, and the Apple Watch SE 3 gives you the smartwatch experience for less cost. But what about the Series 11, the anchor to Apple's watch lin… [+10280 chars]",2026-04-22 11:15:47+00:00,https://www.cnet.com/tech/mobile/apple-watch-series-11-vs-series-10-how-these-nearly-identical-watches-compare/,en,[],"{'source': {'id': None, 'name': 'CNET'}, 'author': 'Jeff Carlson', 'title': 'Apple Watch Series 11 vs. Series 10: How These Nearly Identical Watches Compare', 'description': ""You might think Apple forgot to improve its latest flagship Apple Watch, but there are some differences from last year's model."", 'url': 'https://www.cnet.com/tech/mobile/apple-watch-series-11-vs-series-10-how-these-nearly-identical-watches-compare/', 'urlToImage': 'https://www.cnet.com/a/img/resize/05c9218da9f55cac7bc5babedd7cde43a9b678d7/hub/2025/09/22/4fed8199-1cbb-4561-969f-3619d72118c0/apple-watch-s11-vs-s10.png?auto=webp&fit=crop&height=675&width=1200', 'publishedAt': '2026-04-22T11:15:47Z', 'content': ""The\xa0Apple Watch\xa0Ultra 3\xa0is distinctive in shape and features, and the Apple Watch\xa0SE 3\xa0gives you the smartwatch experience for less cost. But what about the\xa0Series 11, the anchor to Apple's watch lin… [+10280 chars]""}"
0c5e82b12f91191f41aa19c33d7ed9f53466f4b22c8264685b3fd6f17a996a99,Yahoo Entertainment,AT&T beats Q1 wireless subscriber estimates on bundling,,"If you click 'Accept all', we and our partners, including 250 who are part of the IAB Transparency &amp; Consent Framework, will also store and / or access information on a device (in other words, us… [+1046 chars]",2026-04-22 11:15:25+00:00,https://consent.yahoo.com/v2/collectConsent?sessionId=1_cc-session_144a7613-9493-4586-93ce-899faf604166,en,[],"{'source': {'id': None, 'name': 'Yahoo Entertainment'}, 'author': None, 'title': 'AT&T beats Q1 wireless subscriber estimates on bundling', 'description': None, 'url': 'https://consent.yahoo.com/v2/collectConsent?sessionId=1_cc-session_144a7613-9493-4586-93ce-899faf604166', 'urlToImage': None, 'publishedAt': '2026-04-22T11:15:25Z', 'content': ""If you click 'Accept all', we and our partners, including 250 who are part of the IAB Transparency &amp; Consent Framework, will also store and / or access information on a device (in other words, us… [+1046 chars]""}"
