hash,source,title,description,content,published_at,url,language,tickers,raw
a13f2a3263b75c7c99f1f7297f46368302bd3a4d3029ac27cab57ac8b6502f39,Www.gov.uk,Mr F McBride v Greene King Retail Services Ltd: 8000961/2025,Employment Tribunal decision.,"We use some essential cookies to make this website work.
Wed like to set additional cookies to understand how you use GOV.UK, remember your settings and improve government services.
We also use coo… [+70 chars]",2026-04-22 11:09:26+00:00,https://www.gov.uk/employment-tribunal-decisions/mr-f-mcbride-v-greene-king-retail-services-ltd-8000961-slash-2025,en,[],"{'source': {'id': None, 'name': 'Www.gov.uk'}, 'author': 'HM Courts & Tribunals Service', 'title': 'Mr F McBride v Greene King Retail Services Ltd: 8000961/2025', 'description': 'Employment Tribunal decision.', 'url': 'https://www.gov.uk/employment-tribunal-decisions/mr-f-mcbride-v-greene-king-retail-services-ltd-8000961-slash-2025', 'urlToImage': 'https://www.gov.uk/assets/frontend/govuk-opengraph-image-4196a4d6333cf92aaf720047f56cfd91b3532d7635fc21ebcf0d5897df6b5f77.png', 'publishedAt': '2026-04-22T11:09:26Z', 'content': 'We use some essential cookies to make this website work.\r\nWed like to set additional cookies to understand how you use GOV.UK, remember your settings and improve government services.\r\nWe also use coo… [+70 chars]'}"
f6f2354475c3cae0263bc40aa5941385191f59e84e0caa01bde58fd51a6563d0,Yahoo Entertainment,Similarweb (SMWB) Launches Unified Retail Intelligence Suite with Amazon IQ Integration,,"If you click 'Accept all', we and our partners, including 250 who are part of the IAB Transparency &amp; Consent Framework, will also store and / or access information on a device (in other words, us… [+1046 chars]",2026-04-22 11:09:24+00:00,https://consent.yahoo.com/v2/collectConsent?sessionId=1_cc-session_a59e10ed-e52c-4e0f-a22c-22e91419c74b,en,[],"{'source': {'id': None, 'name': 'Yahoo Entertainment'}, 'author': None, 'title': 'Similarweb (SMWB) Launches Unified Retail Intelligence Suite with Amazon IQ Integration', 'description': None, 'url': 'https://consent.yahoo.com/v2/collectConsent?sessionId=1_cc-session_a59e10ed-e52c-4e0f-a22c-22e91419c74b', 'urlToImage': None, 'publishedAt': '2026-04-22T11:09:24Z', 'content': ""If you click 'Accept all', we and our partners, including 250 who are part of the IAB Transparency &amp; Consent Framework, will also store and / or access information on a device (in other words, us… [+1046 chars]""}"
fe0da64e3f89211ec6754500f99268f522e4802df340c763585205e6720d85a5,Yahoo Entertainment,Intapp (INTA) Expands Partnership to Integrate Activator Research into Celeste AI Platform,Intapp Inc. (NASDAQ:INTA) is one of the 10 Oversold Tech Stocks to Buy According to Analysts. Intapp Inc. (NASDAQ:INTA) is one of the oversold tech stocks to...,"Intapp Inc. (NASDAQ:INTA) is one of the
10 Oversold Tech Stocks to Buy According to Analysts.
Intapp Inc. (NASDAQ:INTA) is one of the oversold tech stocks to buy according to analysts. On April 20,… [+2399 chars]",2026-04-22 11:09:14+00:00,https://finance.yahoo.com/sectors/technology/articles/intapp-inta-expands-partnership-integrate-110914110.html,en,[],"{'source': {'id': None, 'name': 'Yahoo Entertainment'}, 'author': 'Maham Fatima', 'title': 'Intapp (INTA) Expands Partnership to Integrate Activator Research into Celeste AI Platform', 'description': 'Intapp Inc. (NASDAQ:INTA) is one of the 10 Oversold Tech Stocks to Buy According to Analysts. Intapp Inc. (NASDAQ:INTA) is one of the oversold tech stocks to...', 'url': 'https://finance.yahoo.com/sectors/technology/articles/intapp-inta-expands-partnership-integrate-110914110.html', 'urlToImage': 'https://s.yimg.com/ny/api/res/1.2/ZsCaDZePB6A8ZdFCMFRxYA--/YXBwaWQ9aGlnaGxhbmRlcjt3PTEyMDA7aD04MDA-/https://media.zenfs.com/en/insidermonkey.com/d6912d9cec26d31e2eda86788713cbd3', 'publishedAt': '2026-04-22T11:09:14Z', 'content': 'Intapp Inc. (NASDAQ:INTA) is one of the\r\n10 Oversold Tech Stocks to Buy According to Analysts.\r\nIntapp Inc. (NASDAQ:INTA) is one of the oversold tech stocks to buy according to analysts. On April 20,… [+2399 chars]'}"
2dac58cf85b556f29e8d837380333943566987ffd2d7e5ac4b317b2fdc3a13dd,Yahoo Entertainment,BlackLine (BL) Announces Agentic Financial Operations Model for AI Adoption in Finance,,"If you click 'Accept all', we and our partners, including 250 who are part of the IAB Transparency &amp; Consent Framework, will also store and / or access information on a device (in other words, us… [+1046 chars]",2026-04-22 11:09:05+00:00,https://consent.yahoo.com/v2/collectConsent?sessionId=1_cc-session_b366fe14-fcef-4a18-bdef-15deccffa6c0,en,[],"{'source': {'id': None, 'name': 'Yahoo Entertainment'}, 'author': None, 'title': 'BlackLine (BL) Announces Agentic Financial Operations Model for AI Adoption in Finance', 'description': None, 'url': 'https://consent.yahoo.com/v2/collectConsent?sessionId=1_cc-session_b366fe14-fcef-4a18-bdef-15deccffa6c0', 'urlToImage': None, 'publishedAt': '2026-04-22T11:09:05Z', 'content': ""If you click 'Accept all', we and our partners, including 250 who are part of the IAB Transparency &amp; Consent Framework, will also store and / or access information on a device (in other words, us… [+1046 chars]""}"
146e86ddada4a38ecf58397d3ecabece4a1b093d5c4356927bad58107e44b0ab,Yahoo Entertainment,Here is Why Wrap Technologies (WRAP) an Oversold Tech Stock to Buy According to Analysts,,"If you click 'Accept all', we and our partners, including 250 who are part of the IAB Transparency &amp; Consent Framework, will also store and / or access information on a device (in other words, us… [+1046 chars]",2026-04-22 11:08:54+00:00,https://consent.yahoo.com/v2/collectConsent?sessionId=1_cc-session_c5ce7706-2be8-4891-a580-91364c0468e1,en,[],"{'source': {'id': None, 'name': 'Yahoo Entertainment'}, 'author': None, 'title': 'Here is Why Wrap Technologies (WRAP) an Oversold Tech Stock to Buy According to Analysts', 'description': None, 'url': 'https://consent.yahoo.com/v2/collectConsent?sessionId=1_cc-session_c5ce7706-2be8-4891-a580-91364c0468e1', 'urlToImage': None, 'publishedAt': '2026-04-22T11:08:54Z', 'content': ""If you click 'Accept all', we and our partners, including 250 who are part of the IAB Transparency &amp; Consent Framework, will also store and / or access information on a device (in other words, us… [+1046 chars]""}"
9f58358f3a0957bc98ec1fdc64856d6aba8362d65c5326517417036cad7df7c9,Yahoo Entertainment,XBP Global Holdings (XBP) Secures Over €1M AI Healthcare Contract,XBP Global Holdings Inc. (NASDAQ:XBP) is one of the 10 Oversold Tech Stocks to Buy According to Analysts. XBP Global Holdings Inc. (NASDAQ:XBP) is one of the...,"XBP Global Holdings Inc. (NASDAQ:XBP) is one of the
10 Oversold Tech Stocks to Buy According to Analysts.
XBP Global Holdings Inc. (NASDAQ:XBP) is one of the oversold tech stocks to buy according t… [+2185 chars]",2026-04-22 11:08:48+00:00,https://finance.yahoo.com/sectors/healthcare/articles/xbp-global-holdings-xbp-secures-110848916.html,en,[],"{'source': {'id': None, 'name': 'Yahoo Entertainment'}, 'author': 'Maham Fatima', 'title': 'XBP Global Holdings (XBP) Secures Over €1M AI Healthcare Contract', 'description': 'XBP Global Holdings Inc. (NASDAQ:XBP) is one of the 10 Oversold Tech Stocks to Buy According to Analysts. XBP Global Holdings Inc. (NASDAQ:XBP) is one of the...', 'url': 'https://finance.yahoo.com/sectors/healthcare/articles/xbp-global-holdings-xbp-secures-110848916.html', 'urlToImage': 'https://s.yimg.com/ny/api/res/1.2/1cYvW2Hn3qHNFWdOUOfrDA--/YXBwaWQ9aGlnaGxhbmRlcjt3PTEyMDA7aD04MDA-/https://media.zenfs.com/en/insidermonkey.com/c5fec8e53a9b096a2c18985b5efac602', 'publishedAt': '2026-04-22T11:08:48Z', 'content': 'XBP Global Holdings Inc. (NASDAQ:XBP) is one of the\r\n10 Oversold Tech Stocks to Buy According to Analysts.\r\nXBP Global Holdings Inc. (NASDAQ:XBP) is one of the oversold tech stocks to buy according t… [+2185 chars]'}"
246e52874d61eb25758115581a5696c71e4e5f0d59c1dd3b784294d1f70e4643,Yahoo Entertainment,Expensify (EXFY) Partners with IOCP to Expand Modern Spend Management and BYOC Program,,"If you click 'Accept all', we and our partners, including 250 who are part of the IAB Transparency &amp; Consent Framework, will also store and / or access information on a device (in other words, us… [+1046 chars]",2026-04-22 11:08:39+00:00,https://consent.yahoo.com/v2/collectConsent?sessionId=1_cc-session_bcd8e9fa-8e2d-4374-b6df-b02105af6c52,en,[],"{'source': {'id': None, 'name': 'Yahoo Entertainment'}, 'author': None, 'title': 'Expensify (EXFY) Partners with IOCP to Expand Modern Spend Management and BYOC Program', 'description': None, 'url': 'https://consent.yahoo.com/v2/collectConsent?sessionId=1_cc-session_bcd8e9fa-8e2d-4374-b6df-b02105af6c52', 'urlToImage': None, 'publishedAt': '2026-04-22T11:08:39Z', 'content': ""If you click 'Accept all', we and our partners, including 250 who are part of the IAB Transparency &amp; Consent Framework, will also store and / or access information on a device (in other words, us… [+1046 chars]""}"
7abb2557f27a05c408a5fb946c9176d1f1e5293afa45c4734a9e0ecdd48443ab,9to5Mac,"This is Ternus’ biggest challenge, as he and Cook notch up key win","We learned yesterday that Apple was at risk of losing Mike Rockwell, the exec tasked with rescuing the new Siri project after Tim Cook lost confidence in former AI head John Giannandrea.



A deal appears to have been struck to retain Rockwell long enough to …","We learned yesterday that Apple was at risk of losing Mike Rockwell, the exec tasked with rescuing the new Siri project after Tim Cook lost confidence in former AI head John Giannandrea.
A deal appe… [+3286 chars]",2026-04-22 11:08:34+00:00,https://9to5mac.com/2026/04/22/this-is-ternus-biggest-challenge-as-he-and-cook-notch-up-key-win/,en,[],"{'source': {'id': None, 'name': '9to5Mac'}, 'author': 'Ben Lovejoy', 'title': 'This is Ternus’ biggest challenge, as he and Cook notch up key win', 'description': 'We learned yesterday that Apple was at risk of losing Mike Rockwell, the exec tasked with rescuing the new Siri project after Tim Cook lost confidence in former AI head John Giannandrea.\n\n\n\nA deal appears to have been struck to retain Rockwell long enough to …', 'url': 'https://9to5mac.com/2026/04/22/this-is-ternus-biggest-challenge-as-he-and-cook-notch-up-key-win/', 'urlToImage': 'https://i0.wp.com/9to5mac.com/wp-content/uploads/sites/6/2026/04/john-ternus.jpg?resize=1200%2C628&quality=82&strip=all&ssl=1', 'publishedAt': '2026-04-22T11:08:34Z', 'content': 'We learned yesterday that Apple was at risk of losing Mike Rockwell, the exec tasked with rescuing the new Siri project after Tim Cook lost confidence in former AI head John Giannandrea.\r\nA deal appe… [+3286 chars]'}"
7b8257526a6c75d6561401cb176a55e7d66662d12c2eadf66d7f90d87bd454eb,Yahoo Entertainment,PAR Technology (PAR) Launches Autonomous Agentic AI Layer PAR Intelligence,,"If you click 'Accept all', we and our partners, including 250 who are part of the IAB Transparency &amp; Consent Framework, will also store and / or access information on a device (in other words, us… [+1046 chars]",2026-04-22 11:08:30+00:00,https://consent.yahoo.com/v2/collectConsent?sessionId=1_cc-session_e8317b57-1888-4617-958b-839fc57c9eb6,en,[],"{'source': {'id': None, 'name': 'Yahoo Entertainment'}, 'author': None, 'title': 'PAR Technology (PAR) Launches Autonomous Agentic AI Layer PAR Intelligence', 'description': None, 'url': 'https://consent.yahoo.com/v2/collectConsent?sessionId=1_cc-session_e8317b57-1888-4617-958b-839fc57c9eb6', 'urlToImage': None, 'publishedAt': '2026-04-22T11:08:30Z', 'content': ""If you click 'Accept all', we and our partners, including 250 who are part of the IAB Transparency &amp; Consent Framework, will also store and / or access information on a device (in other words, us… [+1046 chars]""}"
66fb39194be48761e63b87219f7ba7fef0679e7932f7a6719c3ea69397bd7b6e,Yahoo Entertainment,Exodus Movement (EXOD) Expands Native Support for XRP Ledger in Self-Custody Wallet,,"If you click 'Accept all', we and our partners, including 250 who are part of the IAB Transparency &amp; Consent Framework, will also store and / or access information on a device (in other words, us… [+1046 chars]",2026-04-22 11:08:22+00:00,https://consent.yahoo.com/v2/collectConsent?sessionId=1_cc-session_204a31d3-e741-4bdc-9a11-ee3d3c9d52fa,en,[],"{'source': {'id': None, 'name': 'Yahoo Entertainment'}, 'author': None, 'title': 'Exodus Movement (EXOD) Expands Native Support for XRP Ledger in Self-Custody Wallet', 'description': None, 'url': 'https://consent.yahoo.com/v2/collectConsent?sessionId=1_cc-session_204a31d3-e741-4bdc-9a11-ee3d3c9d52fa', 'urlToImage': None, 'publishedAt': '2026-04-22T11:08:22Z', 'content': ""If you click 'Accept all', we and our partners, including 250 who are part of the IAB Transparency &amp; Consent Framework, will also store and / or access information on a device (in other words, us… [+1046 chars]""}"
d6d2845db951eb701d1f17457966b5bd95a89817d7500b267653ba1bdaf74f09,Www.gov.uk,Mr A Bruce v RAD Ltd: 8000604/2025,Employment Tribunal decision.,"We use some essential cookies to make this website work.
Wed like to set additional cookies to understand how you use GOV.UK, remember your settings and improve government services.
We also use coo… [+70 chars]",2026-04-22 11:08:02+00:00,https://www.gov.uk/employment-tribunal-decisions/mr-a-bruce-v-rad-ltd-8000604-slash-2025,en,[],"{'source': {'id': None, 'name': 'Www.gov.uk'}, 'author': 'HM Courts & Tribunals Service', 'title': 'Mr A Bruce v RAD Ltd: 8000604/2025', 'description': 'Employment Tribunal decision.', 'url': 'https://www.gov.uk/employment-tribunal-decisions/mr-a-bruce-v-rad-ltd-8000604-slash-2025', 'urlToImage': 'https://www.gov.uk/assets/frontend/govuk-opengraph-image-4196a4d6333cf92aaf720047f56cfd91b3532d7635fc21ebcf0d5897df6b5f77.png', 'publishedAt': '2026-04-22T11:08:02Z', 'content': 'We use some essential cookies to make this website work.\r\nWed like to set additional cookies to understand how you use GOV.UK, remember your settings and improve government services.\r\nWe also use coo… [+70 chars]'}"
2862d0233a38d0ef461dc3da44bd97131dee6ac948164f0a3ade08c55eb8a109,Successful-blog.com,How to Start a Blog and Make Money: Beginner’s Guide to Blogging Success in 2026,"Blogging in 2026 is far from dead in fact, it’s more profitable and competitive than ever. With the rise of AI tools, content saturation, and evolving search engine algorithms, starting a blog today requires strategy, consistency, and a clear monetization pla…","Blogging in 2026 is far from dead in fact, its more profitable and competitive than ever. With the rise of AI tools, content saturation, and evolving search engine algorithms, starting a blog today r… [+7983 chars]",2026-04-22 11:06:57+00:00,https://www.successful-blog.com/1/how-to-start-a-blog-and-make-money/,en,[],"{'source': {'id': None, 'name': 'Successful-blog.com'}, 'author': 'Jessy Troy', 'title': 'How to Start a Blog and Make Money: Beginner’s Guide to Blogging Success in 2026', 'description': 'Blogging in 2026 is far from dead in fact, it’s more profitable and competitive than ever. With the rise of AI tools, content saturation, and evolving search engine algorithms, starting a blog today requires strategy, consistency, and a clear monetization pla…', 'url': 'https://www.successful-blog.com/1/how-to-start-a-blog-and-make-money/', 'urlToImage': 'https://www.successful-blog.com/wp-content/uploads/2026/04/Start-a-Blog-and-Make-Money.webp', 'publishedAt': '2026-04-22T11:06:57Z', 'content': 'Blogging in 2026 is far from dead in fact, its more profitable and competitive than ever. With the rise of AI tools, content saturation, and evolving search engine algorithms, starting a blog today r… [+7983 chars]'}"
846a14ceb25d0b5f0bb636b9156b3a5764d58210999f1cef4e42f948f63812cc,Yahoo Entertainment,Technical Assessment: Bullish in the Intermediate-Term,,"If you click 'Accept all', we and our partners, including 250 who are part of the IAB Transparency &amp; Consent Framework, will also store and / or access information on a device (in other words, us… [+1046 chars]",2026-04-22 11:06:57+00:00,https://consent.yahoo.com/v2/collectConsent?sessionId=1_cc-session_2dad7964-f12a-4612-aa33-fb93a206568e,en,[],"{'source': {'id': None, 'name': 'Yahoo Entertainment'}, 'author': None, 'title': 'Technical Assessment: Bullish in the Intermediate-Term', 'description': None, 'url': 'https://consent.yahoo.com/v2/collectConsent?sessionId=1_cc-session_2dad7964-f12a-4612-aa33-fb93a206568e', 'urlToImage': None, 'publishedAt': '2026-04-22T11:06:57Z', 'content': ""If you click 'Accept all', we and our partners, including 250 who are part of the IAB Transparency &amp; Consent Framework, will also store and / or access information on a device (in other words, us… [+1046 chars]""}"
96adf918d77ebc0ba2225689f0599ed8826b7857414905fcdbb928c07ae5ebd9,Thefutoncritic.com,"ESPN, ABC Announce 2026 WNBA Regular Season Schedule","ESPN, which has televised the WNBA since the league's inaugural season in 1997, will tip off its 30th consecutive season on Saturday, May 9, with expanded coverage across ESPN, ABC, Disney+ and ESPN Deportes.","ESPN, ABC announce 2026 WNBA regular season schedule 
30-game slate highlights league's 30th season with star-studded matchups across ESPN and ABC 
Schedule to feature blockbuster matchups, includi… [+11100 chars]",2026-04-22 11:06:00+00:00,http://www.thefutoncritic.com/news/2026/04/22/espn-abc-announce-2026-wnba-regular-season-schedule-261314/20260422espn03/,en,[],"{'source': {'id': None, 'name': 'Thefutoncritic.com'}, 'author': None, 'title': 'ESPN, ABC Announce 2026 WNBA Regular Season Schedule', 'description': ""ESPN, which has televised the WNBA since the league's inaugural season in 1997, will tip off its 30th consecutive season on Saturday, May 9, with expanded coverage across ESPN, ABC, Disney+ and ESPN Deportes."", 'url': 'http://www.thefutoncritic.com/news/2026/04/22/espn-abc-announce-2026-wnba-regular-season-schedule-261314/20260422espn03/', 'urlToImage': None, 'publishedAt': '2026-04-22T11:06:00Z', 'content': ""ESPN, ABC announce 2026 WNBA regular season schedule \r\n30-game slate highlights league's 30th season with star-studded matchups across ESPN and ABC \r\nSchedule to feature blockbuster matchups, includi… [+11100 chars]""}"
2dee39cc614bc2c179651d7b8d8e609983a76c7d54509e19ad97ae4e084da0d2,Php.net,systems - redirect to infra project,"<table><tr><th>2025/04/17 15:48</th><th>current</th></tr><tr><td>Line 3:</td>
<td>Line 3:</td>
</tr>
<tr><td> </td><td>PHP is supported by a number of machines provided by a number of generous sponsors. This is a basic inventory of those machines and what ser…","Permission Denied
Sorry, you don't have enough rights to continue.
Login
You are currently not logged in! Enter your authentication credentials below to log in. You need to have cookies enabled to… [+7 chars]",2026-04-22 11:05:03+00:00,https://wiki.php.net/systems?rev=1776855903&do=diff,en,[],"{'source': {'id': None, 'name': 'Php.net'}, 'author': 'derick (derick@undisclosed.example.com)', 'title': 'systems - redirect to infra project', 'description': '<table><tr><th>2025/04/17 15:48</th><th>current</th></tr><tr><td>Line 3:</td>\n<td>Line 3:</td>\n</tr>\n<tr><td>\xa0</td><td>PHP is supported by a number of machines provided by a number of generous sponsors. This is a basic inventory of those machines and what ser…', 'url': 'https://wiki.php.net/systems?rev=1776855903&do=diff', 'urlToImage': None, 'publishedAt': '2026-04-22T11:05:03Z', 'content': ""Permission Denied\r\nSorry, you don't have enough rights to continue.\r\nLogin\r\nYou are currently not logged in! Enter your authentication credentials below to log in. You need to have cookies enabled to… [+7 chars]""}"
836d95fe5813fe6c51ee14ca242c78752007f6ba0f28f4353847e79cd94c3825,Yahoo Entertainment,QB for Vikings’ Offseason Rumor Mill May Retire,"When the Minnesota Vikings’ offseason began in January, some spitballed Los Angeles Rams backup quarterback Jimmy Garoppolo as a solution. […]","If you click 'Accept all', we and our partners, including 250 who are part of the IAB Transparency &amp; Consent Framework, will also store and / or access information on a device (in other words, us… [+1046 chars]",2026-04-22 11:05:00+00:00,https://consent.yahoo.com/v2/collectConsent?sessionId=1_cc-session_d62aaf6e-0bc7-4daf-9cf2-d8822b4bd30a,en,[],"{'source': {'id': None, 'name': 'Yahoo Entertainment'}, 'author': None, 'title': 'QB for Vikings’ Offseason Rumor Mill May Retire', 'description': 'When the Minnesota Vikings’ offseason began in January, some spitballed Los Angeles Rams backup quarterback Jimmy Garoppolo as a solution. […]', 'url': 'https://consent.yahoo.com/v2/collectConsent?sessionId=1_cc-session_d62aaf6e-0bc7-4daf-9cf2-d8822b4bd30a', 'urlToImage': None, 'publishedAt': '2026-04-22T11:05:00Z', 'content': ""If you click 'Accept all', we and our partners, including 250 who are part of the IAB Transparency &amp; Consent Framework, will also store and / or access information on a device (in other words, us… [+1046 chars]""}"
f6ddd0a42e987f62a1ffee1b653533bb150882dac2ab6f4352ffa9960734832f,Financial Post,Western Metallica Announces Expiry of Non-Binding LOI With Emerita Resources and Permit Renewal for Nueva Celti,TORONTO — Western Metallica Resources Corp. (TSXV: WMS) (“Western Metallica” or the “Company”) has announced the expiry of the non-binding LOI executed with Emerita Resources Corp. (“EMO”) for the Company’s Nueva Celti property in Andalucia Spain (see news re…,TORONTO Western Metallica Resources Corp. (TSXV: WMS)(Western Metallica or the Company) has announced the expiry of the non-binding LOI executed with Emerita Resources Corp. (EMO) for the Companys Nu… [+2307 chars],2026-04-22 11:04:13+00:00,https://financialpost.com/pmn/business-wire-news-releases-pmn/western-metallica-announces-expiry-of-non-binding-loi-with-emerita-resources-and-permit-renewal-for-nueva-celti,en,[],"{'source': {'id': 'financial-post', 'name': 'Financial Post'}, 'author': 'Business Wire', 'title': 'Western Metallica Announces Expiry of Non-Binding LOI With Emerita Resources and Permit Renewal for Nueva Celti', 'description': 'TORONTO — Western Metallica Resources Corp. (TSXV: WMS) (“Western Metallica” or the “Company”) has announced the expiry of the non-binding LOI executed with Emerita Resources Corp. (“EMO”) for the Company’s Nueva Celti property in Andalucia Spain (see news re…', 'url': 'https://financialpost.com/pmn/business-wire-news-releases-pmn/western-metallica-announces-expiry-of-non-binding-loi-with-emerita-resources-and-permit-renewal-for-nueva-celti', 'urlToImage': None, 'publishedAt': '2026-04-22T11:04:13Z', 'content': 'TORONTO Western Metallica Resources Corp. (TSXV: WMS)(Western Metallica or the Company) has announced the expiry of the non-binding LOI executed with Emerita Resources Corp. (EMO) for the Companys Nu… [+2307 chars]'}"
2d18226a48782927a0eca4f18efe506fa585076bb6cf88e5b930cff422d2f07f,Financial Post,Veristat to Acquire Certara’s Regulatory and Medical Writing Business,"Strategic acquisition expands and enhances Veristat’s regulatory services to help more clinical trial sponsors develop novel, life-saving therapies across complex disease areas SOUTHBOROUGH, Mass. — Veristat (the “Company”), a science-first full-service CRO a…","THIS CONTENT IS RESERVED FOR SUBSCRIBERS ONLY
Subscribe now to read the latest news in your city and across Canada.
<ul><li>Exclusive articles from Barbara Shecter, Joe O'Connor, Gabriel Friedman, … [+5213 chars]",2026-04-22 11:04:00+00:00,https://financialpost.com/pmn/business-wire-news-releases-pmn/veristat-to-acquire-certaras-regulatory-and-medical-writing-business,en,[],"{'source': {'id': 'financial-post', 'name': 'Financial Post'}, 'author': 'Business Wire', 'title': 'Veristat to Acquire Certara’s Regulatory and Medical Writing Business', 'description': 'Strategic acquisition expands and enhances Veristat’s regulatory services to help more clinical trial sponsors develop novel, life-saving therapies across complex disease areas SOUTHBOROUGH, Mass. — Veristat (the “Company”), a science-first full-service CRO a…', 'url': 'https://financialpost.com/pmn/business-wire-news-releases-pmn/veristat-to-acquire-certaras-regulatory-and-medical-writing-business', 'urlToImage': None, 'publishedAt': '2026-04-22T11:04:00Z', 'content': ""THIS CONTENT IS RESERVED FOR SUBSCRIBERS ONLY\r\nSubscribe now to read the latest news in your city and across Canada.\r\n<ul><li>Exclusive articles from Barbara Shecter, Joe O'Connor, Gabriel Friedman, … [+5213 chars]""}"
