hash,source,title,description,content,published_at,url,language,tickers,raw,weak_label
6e5f40e8bfc836efa1bfe09b8bc1c02e1758636a53a35df9e335a7e23291fd37,Macdailynews.com,Incoming CEO John Ternus has an opportunity to supercharge Apple – Gene Munster,"Apple investors anticipated this CEO transition, as reflected in AAPL shares declining just 0.5% following the news that Tim Cook…
The post Incoming CEO John Ternus has an opportunity to supercharge Apple – Gene Munster appeared first on MacDailyNews.","Apple investors anticipated this CEO transition, as reflected in AAPL shares declining just 0.5% following the news that Tim Cook will move into the chairman role. This change opens the door for a fr… [+2509 chars]",2026-04-22 13:20:01+00:00,https://macdailynews.com/2026/04/22/incoming-ceo-john-ternus-has-an-opportunity-to-supercharge-apple-gene-munster/,en,['BIRD'],"{'source': {'id': None, 'name': 'Macdailynews.com'}, 'author': 'MacDailyNews', 'title': 'Incoming CEO John Ternus has an opportunity to supercharge Apple – Gene Munster', 'description': 'Apple investors anticipated this CEO transition, as reflected in AAPL shares declining just 0.5% following the news that Tim Cook…\nThe post Incoming CEO John Ternus has an opportunity to supercharge Apple – Gene Munster appeared first on MacDailyNews.', 'url': 'https://macdailynews.com/2026/04/22/incoming-ceo-john-ternus-has-an-opportunity-to-supercharge-apple-gene-munster/', 'urlToImage': 'https://macdailynews.com/wp-content/uploads/2024/05/240501_apple_logo.png', 'publishedAt': '2026-04-22T13:20:01Z', 'content': 'Apple investors anticipated this CEO transition, as reflected in AAPL shares declining just 0.5% following the news that Tim Cook will move into the chairman role. This change opens the door for a fr… [+2509 chars]'}",negative
9b29c7429a339d8d5a0741c3e0d28c436fab612d5db5099b9c2f1866bb61af69,Financial Post,SpaceX has deal for right to acquire Cursor for US$60 billion,SpaceX said it has an agreement giving it the right to acquire artificial intelligence startup Cursor for US$60 billion. Find out more here,"SpaceX said it has an agreement giving it the right to acquire artificial intelligence startup Cursor for US$60 billion later this year or to pay US$10 billion for the companies work together, part o… [+4761 chars]",2026-04-22 13:19:52+00:00,https://financialpost.com/technology/spacex-right-to-acquire-cursor,en,['BIRD'],"{'source': {'id': 'financial-post', 'name': 'Financial Post'}, 'author': 'Bloomberg News', 'title': 'SpaceX has deal for right to acquire Cursor for US$60 billion', 'description': 'SpaceX said it has an agreement giving it the right to acquire artificial intelligence startup Cursor for US$60 billion. Find out more here', 'url': 'https://financialpost.com/technology/spacex-right-to-acquire-cursor', 'urlToImage': 'https://smartcdn.gprod.postmedia.digital/financialpost/wp-content/uploads/2026/04/0423-mg-cursor.jpg', 'publishedAt': '2026-04-22T13:19:52Z', 'content': 'SpaceX said it has an agreement giving it the right to acquire artificial intelligence startup Cursor for US$60 billion later this year or to pay US$10 billion for the companies work together, part o… [+4761 chars]'}",positive
698fe86aa67e7338757ca4e4e0095e97c7521941c94b495ab3d653654a694912,CBS News,"Secretary Duffy says ""AI is a tool"" but won't replace air traffic controllers","Transportation Secretary Sean Duffy said ""we do not replace humans,"" as he discussed pushing for a new AI system that he says will help air traffic controllers. Kris Van Cleave has more.",Copyright ©2026 CBS Interactive Inc. All rights reserved.,2026-04-22 13:18:39+00:00,https://www.cbsnews.com/video/secretary-duffy-says-ai-is-a-tool-but-wont-replace-air-traffic-controllers/,en,['BIRD'],"{'source': {'id': 'cbs-news', 'name': 'CBS News'}, 'author': 'CBS News', 'title': 'Secretary Duffy says ""AI is a tool"" but won\'t replace air traffic controllers', 'description': 'Transportation Secretary Sean Duffy said ""we do not replace humans,"" as he discussed pushing for a new AI system that he says will help air traffic controllers. Kris Van Cleave has more.', 'url': 'https://www.cbsnews.com/video/secretary-duffy-says-ai-is-a-tool-but-wont-replace-air-traffic-controllers/', 'urlToImage': 'https://assets2.cbsnewsstatic.com/hub/i/r/2026/04/22/59dd4c61-dd18-4d63-b23c-831fe0f55d30/thumbnail/1200x630/c6183608bb47622aa3d34d6ed7aa0e55/cbsn-fusion-secretary-duffy-says-ai-is-a-tool-but-wont-replace-air-traffic-controllers-thumbnail.jpg', 'publishedAt': '2026-04-22T13:18:39Z', 'content': 'Copyright ©2026 CBS Interactive Inc. All rights reserved.'}",neutral
1ab8c95f42768363871fe86e4adc22655871a3bbd39d76c9139bec9b9f57b339,Pypi.org,mindgard 0.110.1,Test your AI model's security without leaving your terminal.,"A required part of this site couldnt load. This may be due to a browser
 extension, network issues, or browser settings. Please check your
 connection, disable any ad blockers, or try using a diffe… [+12 chars]",2026-04-22 13:18:36+00:00,https://pypi.org/project/mindgard/0.110.1/,en,['BIRD'],"{'source': {'id': None, 'name': 'Pypi.org'}, 'author': 'support@mindgard.ai', 'title': 'mindgard 0.110.1', 'description': ""Test your AI model's security without leaving your terminal."", 'url': 'https://pypi.org/project/mindgard/0.110.1/', 'urlToImage': None, 'publishedAt': '2026-04-22T13:18:36Z', 'content': 'A required part of this site couldnt load. This may be due to a browser\r\n extension, network issues, or browser settings. Please check your\r\n connection, disable any ad blockers, or try using a diffe… [+12 chars]'}",neutral
84f1e84b81ef3f6529d5249f45c3f1807bc86de25b9226eec7e2dea4bfed65d2,Showbiz Cheat Sheet,Here’s The FULL Story Of Who D4vd is … How He Got Famous … And How He Killed That Girl!,"D4vd is best known for his recent arrest now, but he rose to fame in 2021 on TikTok. He rose to fame quickly, and fell even quicker.","David Anthony Burke, better known by his stage name D4vd, has been arrested and charged with the murder of 14-year-old Celeste Rivas Hernandez. The TikToker-turned-musicians legal troubles have domin… [+6035 chars]",2026-04-22 13:18:00+00:00,https://www.cheatsheet.com/news/d4vds-rise-to-fame-and-fall-from-grace-key-moments.html/#article,en,['BIRD'],"{'source': {'id': None, 'name': 'Showbiz Cheat Sheet'}, 'author': 'Media Take Out Staff', 'title': 'Here’s The FULL Story Of Who D4vd is … How He Got Famous … And How He Killed That Girl!', 'description': 'D4vd is best known for his recent arrest now, but he rose to fame in 2021 on TikTok. He rose to fame quickly, and fell even quicker.', 'url': 'https://www.cheatsheet.com/news/d4vds-rise-to-fame-and-fall-from-grace-key-moments.html/#article', 'urlToImage': 'https://www.cheatsheet.com/wp-content/uploads/2026/04/GettyImages-2271714820.webp?w=1200', 'publishedAt': '2026-04-22T13:18:00Z', 'content': 'David Anthony Burke, better known by his stage name D4vd, has been arrested and charged with the murder of 14-year-old Celeste Rivas Hernandez. The TikToker-turned-musicians legal troubles have domin… [+6035 chars]'}",neutral
eeccc510a52149c46f4f285e09bd40850d979cf6c0d61404f0aaa6a2a25cf5e7,Business Insider,Google says 75% of the company's new code is AI-generated,The amount of code being created by AI at Google has grown as the company pushes staff to adopt coding assistants and agents.,"Raj K Raj/Hindustan Times via Getty Images
<ul><li>Three-quarters of new code at Google is being generated by AI, the company said.</li><li>The number has been steadily increasing as the company pus… [+1535 chars]",2026-04-22 13:17:48+00:00,https://www.businessinsider.com/google-ai-generated-code-75-gemini-agents-software-2026-4,en,['BIRD'],"{'source': {'id': 'business-insider', 'name': 'Business Insider'}, 'author': 'Hugh Langley', 'title': ""Google says 75% of the company's new code is AI-generated"", 'description': 'The amount of code being created by AI at Google has grown as the company pushes staff to adopt coding assistants and agents.', 'url': 'https://www.businessinsider.com/google-ai-generated-code-75-gemini-agents-software-2026-4', 'urlToImage': 'https://i.insider.com/69e8c753a98bc8fdc096d533?width=1200&format=jpeg', 'publishedAt': '2026-04-22T13:17:48Z', 'content': 'Raj K Raj/Hindustan Times via Getty Images\r\n<ul><li>Three-quarters of new code at Google is being generated by AI, the company said.</li><li>The number has been steadily increasing as the company pus… [+1535 chars]'}",positive
3cdf856ef2ae2a28ada4d368cefad3a0925fdbea66afdf371f95a01647d08ab4,Logisticsviewpoints.com,Hormuz Tensions Elevate the Middle Corridor From Alternative Route to Strategic Imperative,"The latest disruption around the Strait of Hormuz is reinforcing a broader supply chain reality. Trade lanes are now being evaluated not just on cost and transit time, but on geopolitical exposure, chokepoint risk, and the ability to preserve continuity when …","The latest disruption around the Strait of Hormuz is reinforcing a broader supply chain reality. Trade lanes are now being evaluated not just on cost and transit time, but on geopolitical exposure, c… [+6925 chars]",2026-04-22 13:17:32+00:00,https://logisticsviewpoints.com/2026/04/22/hormuz-tensions-elevate-the-middle-corridor-from-alternative-route-to-strategic-imperative/,en,['BIRD'],"{'source': {'id': None, 'name': 'Logisticsviewpoints.com'}, 'author': 'Jim Frazer', 'title': 'Hormuz Tensions Elevate the Middle Corridor From Alternative Route to Strategic Imperative', 'description': 'The latest disruption around the Strait of Hormuz is reinforcing a broader supply chain reality. Trade lanes are now being evaluated not just on cost and transit time, but on geopolitical exposure, chokepoint risk, and the ability to preserve continuity when …', 'url': 'https://logisticsviewpoints.com/2026/04/22/hormuz-tensions-elevate-the-middle-corridor-from-alternative-route-to-strategic-imperative/', 'urlToImage': 'https://logisticsviewpoints.com/wp-content/uploads/2026/04/Middle_Corridor_Logo.svg-scaled.png', 'publishedAt': '2026-04-22T13:17:32Z', 'content': 'The latest disruption around the Strait of Hormuz is reinforcing a broader supply chain reality. Trade lanes are now being evaluated not just on cost and transit time, but on geopolitical exposure, c… [+6925 chars]'}",positive
4a5a17117b34d71066e460dc41b321de87ca9b2a7bd384c9e2276002ce0d4269,Yahoo Entertainment,AI Disruption Fears Pressured Salesforce (CRM) in Q1,,"If you click 'Accept all', we and our partners, including 250 who are part of the IAB Transparency &amp; Consent Framework, will also store and / or access information on a device (in other words, us… [+1046 chars]",2026-04-22 13:17:26+00:00,https://consent.yahoo.com/v2/collectConsent?sessionId=1_cc-session_cc52cc33-dd23-477d-87df-1722ca9687c8,en,['BIRD'],"{'source': {'id': None, 'name': 'Yahoo Entertainment'}, 'author': None, 'title': 'AI Disruption Fears Pressured Salesforce (CRM) in Q1', 'description': None, 'url': 'https://consent.yahoo.com/v2/collectConsent?sessionId=1_cc-session_cc52cc33-dd23-477d-87df-1722ca9687c8', 'urlToImage': None, 'publishedAt': '2026-04-22T13:17:26Z', 'content': ""If you click 'Accept all', we and our partners, including 250 who are part of the IAB Transparency &amp; Consent Framework, will also store and / or access information on a device (in other words, us… [+1046 chars]""}",negative
1c71841f1e804eb6910d4e96cd96ac40ff53555e287b16b1d5e3751af0230454,BGR,China's Greenhouse Tech Is Revolutionizing Farming - Here's How,Farming sustainability is a key pillar in managing mounting environmental and economic challenges worldwide. China's greenhouse tech is setting the standard.,"In the farming industry, sustainability is a constant concern. Greenhouse operators need to manage labor costs, energy costs, regulatory compliance, and economic demands simultaneously, all the while… [+1556 chars]",2026-04-22 13:17:00+00:00,https://www.bgr.com/2149569/china-greenhouse-tech-revolutionizing-farming/,en,['BIRD'],"{'source': {'id': None, 'name': 'BGR'}, 'author': 'staff@bgr.com (Jonathan Sayers)', 'title': ""China's Greenhouse Tech Is Revolutionizing Farming - Here's How"", 'description': ""Farming sustainability is a key pillar in managing mounting environmental and economic challenges worldwide. China's greenhouse tech is setting the standard."", 'url': 'https://www.bgr.com/2149569/china-greenhouse-tech-revolutionizing-farming/', 'urlToImage': 'https://www.bgr.com/img/gallery/chinas-greenhouse-tech-is-revolutionizing-farming-heres-how/l-intro-1776314092.jpg', 'publishedAt': '2026-04-22T13:17:00Z', 'content': 'In the farming industry, sustainability is a constant concern. Greenhouse operators need to manage labor costs, energy costs, regulatory compliance, and economic demands simultaneously, all the while… [+1556 chars]'}",neutral
f1ee58a3aa03a526f894e6d461ee31e9cf7938961e6be3dc28db2aca128a063b,BusinessLine,Three-day rally snapped: IT rout and geopolitical jitters pull Nifty down,"The Nifty 50 fell 198.50 points, or 0.81%, to close at 24,378.10, while the Sensex dropped 756.84 points, or 0.95%, to settle at 78,516.49","Benchmark indices snapped a three-session winning streak on Wednesday, pulled lower by a sharp sell-off in IT stocks and renewed geopolitical uncertainty, as stalled US-Iran peace talks dampened the … [+4252 chars]",2026-04-22 13:16:33+00:00,https://www.thehindubusinessline.com/markets/three-day-rally-snapped-it-rout-and-geopolitical-jitters-pull-nifty-down/article70892939.ece,en,['BIRD'],"{'source': {'id': None, 'name': 'BusinessLine'}, 'author': 'Anupama Ghosh', 'title': 'Three-day rally snapped: IT rout and geopolitical jitters pull Nifty down', 'description': 'The Nifty 50 fell 198.50 points, or 0.81%, to close at 24,378.10, while the Sensex dropped 756.84 points, or 0.95%, to settle at 78,516.49', 'url': 'https://www.thehindubusinessline.com/markets/three-day-rally-snapped-it-rout-and-geopolitical-jitters-pull-nifty-down/article70892939.ece', 'urlToImage': 'https://bl-i.thgim.com/public/incoming/gx501i/article70887639.ece/alternates/LANDSCAPE_1200/PO05_World_stockchart.jpg', 'publishedAt': '2026-04-22T13:16:33Z', 'content': 'Benchmark indices snapped a three-session winning streak on Wednesday, pulled lower by a sharp sell-off in IT stocks and renewed geopolitical uncertainty, as stalled US-Iran peace talks dampened the … [+4252 chars]'}",negative
36dc46d18482b81eda659a1a8d7ee3adc203d1afd5010f68de5f17c9fc3fd14b,W3.org,[Cfp] SEMANTiCS 2026: Research and Innovation Track Submission Deadline Extension,,"*Submission Deadline extension: Research and Innovation Track*

Dear colleagues,

We are pleased to announce an extension of the submission deadline for the Research and Innovation Track at SEMANTiCS… [+1373 chars]",2026-04-22 13:16:09+00:00,https://lists.w3.org/Archives/Public/public-lod/2026Apr/0008.html,en,['BIRD'],"{'source': {'id': None, 'name': 'W3.org'}, 'author': 'Taffa, Tilahun Abedissa', 'title': '[Cfp] SEMANTiCS 2026: Research and Innovation Track Submission Deadline Extension', 'description': None, 'url': 'https://lists.w3.org/Archives/Public/public-lod/2026Apr/0008.html', 'urlToImage': None, 'publishedAt': '2026-04-22T13:16:09Z', 'content': '*Submission Deadline extension: Research and Innovation Track*\n\nDear colleagues,\n\nWe are pleased to announce an extension of the submission deadline for the Research and Innovation Track at SEMANTiCS… [+1373 chars]'}",positive
d12463e6befa8dc4ba119345fc55e3d816580b48e7ae80cbcb569260c1ae8938,The Times of India,"Google makes it official, tells Nvidia: Yes, we are coming after you with our new ...","Google unveils new TPUs, the 8i and 8t, for advanced AI agents. These chips aim to boost AI performance and efficiency. Google's integrated approach, from hardware to data centers, positions them to lead the agentic AI era. Major companies like Meta and Anthr…","<ul><li>News</li>
<li>Google makes it official, tells Nvidia: Yes, we are coming after you with our new ...</li></ul>
Follow Us On Social Media",2026-04-22 13:15:51+00:00,https://timesofindia.indiatimes.com/technology/tech-news/google-makes-it-official-tells-nvidia-yes-we-are-coming-after-you-with-our-new-/articleshow/130442836.cms,en,['BIRD'],"{'source': {'id': 'the-times-of-india', 'name': 'The Times of India'}, 'author': 'Sourabh Kulesh', 'title': 'Google makes it official, tells Nvidia: Yes, we are coming after you with our new ...', 'description': ""Google unveils new TPUs, the 8i and 8t, for advanced AI agents. These chips aim to boost AI performance and efficiency. Google's integrated approach, from hardware to data centers, positions them to lead the agentic AI era. Major companies like Meta and Anthr…"", 'url': 'https://timesofindia.indiatimes.com/technology/tech-news/google-makes-it-official-tells-nvidia-yes-we-are-coming-after-you-with-our-new-/articleshow/130442836.cms', 'urlToImage': 'https://static.toiimg.com/thumb/msid-130442830,width-1280,height-720,imgsize-45218,resizemode-6,overlay-toi_sw,pt-32,y_pad-600/photo.jpg', 'publishedAt': '2026-04-22T13:15:51Z', 'content': '<ul><li>News</li>\r\n<li>Google makes it official, tells Nvidia: Yes, we are coming after you with our new ...</li></ul>\r\nFollow Us On Social Media'}",positive
f208c20a05a182bc8d4e018c1c13e9ccc840acb8b9f9ffb05207abafb95ce3a3,Pypi.org,mcp-k8s-utility added to PyPI,"AI-assisted Kubernetes toil elimination — LLM-agnostic, policy-gated, audit-chained.","Download the file for your platform. If you're not sure which to choose, learn more about installing packages. 
Source Distribution 
Built Distribution 
Filter files by name, interpreter, ABI, and… [+144 chars]",2026-04-22 13:15:09+00:00,https://pypi.org/project/mcp-k8s-utility/,en,['BIRD'],"{'source': {'id': None, 'name': 'Pypi.org'}, 'author': 'vellankikoti@gmail.com', 'title': 'mcp-k8s-utility added to PyPI', 'description': 'AI-assisted Kubernetes toil elimination — LLM-agnostic, policy-gated, audit-chained.', 'url': 'https://pypi.org/project/mcp-k8s-utility/', 'urlToImage': 'https://pypi.org/static/images/twitter.abaf4b19.webp', 'publishedAt': '2026-04-22T13:15:09Z', 'content': ""Download the file for your platform. If you're not sure which to choose, learn more about installing packages. \r\nSource Distribution \r\nBuilt Distribution \r\nFilter files by name, interpreter, ABI, and… [+144 chars]""}",positive
e8e2039856a214d49f5c26119d7b29133fff88931e016f83125f1c11398fc7b6,pymnts.com,Uninvited Users Access Anthropic’s Mythos AI Model,"Anthropic’s Mythos AI model has reportedly been accessed by unauthorized users. That’s according to a report Wednesday (April 22) by Bloomberg News, which notes that the company has described Mythos as powerful enough to initiate serious cyberattacks. The rep…","Thats according to a report Wednesday (April 22) by Bloomberg News, which notes that the company has described Mythos as powerful enough to initiate serious cyberattacks.
The report cites a source f… [+2392 chars]",2026-04-22 13:12:20+00:00,https://www.pymnts.com/artificial-intelligence-2/2026/uninvited-users-access-anthropics-mythos-ai-model/,en,['BIRD'],"{'source': {'id': None, 'name': 'pymnts.com'}, 'author': 'PYMNTS', 'title': 'Uninvited Users Access Anthropic’s Mythos AI Model', 'description': 'Anthropic’s Mythos AI model has reportedly been accessed by unauthorized users. That’s according to a\xa0report\xa0Wednesday (April 22) by Bloomberg News, which notes that the company has described Mythos as powerful enough to initiate serious cyberattacks. The rep…', 'url': 'https://www.pymnts.com/artificial-intelligence-2/2026/uninvited-users-access-anthropics-mythos-ai-model/', 'urlToImage': 'https://www.pymnts.com/wp-content/uploads/2026/04/Anthropic-Claude-Mythos-banks.jpg', 'publishedAt': '2026-04-22T13:12:20Z', 'content': 'Thats according to a\xa0report\xa0Wednesday (April 22) by Bloomberg News, which notes that the company has described Mythos as powerful enough to initiate serious cyberattacks.\r\nThe report cites a source f… [+2392 chars]'}",neutral
311e8d2eeb16d9c01677381d8525eb60f096fb7eb86d3bd37772e2c6a1b63135,Pypi.org,ai-service-modules added to PyPI,"Unified interface for LLM, TTS, and STT providers","This repository provides a unified interface to interact with multiple Large Language Model (LLM) providers for tasks like:
<ul><li> Text Generation &amp; Chat Completion</li><li> Text-to-Speech (TT… [+5659 chars]",2026-04-22 13:12:07+00:00,https://pypi.org/project/ai-service-modules/,en,['BIRD'],"{'source': {'id': None, 'name': 'Pypi.org'}, 'author': 'your@email.com', 'title': 'ai-service-modules added to PyPI', 'description': 'Unified interface for LLM, TTS, and STT providers', 'url': 'https://pypi.org/project/ai-service-modules/', 'urlToImage': 'https://pypi.org/static/images/twitter.abaf4b19.webp', 'publishedAt': '2026-04-22T13:12:07Z', 'content': 'This repository provides a unified interface to interact with multiple Large Language Model (LLM) providers for tasks like:\r\n<ul><li> Text Generation &amp; Chat Completion</li><li> Text-to-Speech (TT… [+5659 chars]'}",neutral
8123116240b007731cf0c84637cd9339645a28f8999253a57b723c18678990d7,Wordpress.org,What’s new in Gutenberg 23.0? (22 April),"“What’s new in Gutenberg” posts (labeled with the #gutenberg-new tag) are posted following every Gutenberg release on a biweekly basis, showcasing new features included in each release. As a reminder, here’s an overview of different ways to keep up with Guten…","Whats new in GutenbergGutenbergThe Gutenberg project is the new Editor Interface for WordPress. The editor improves the process and experience of creating new content, making writing rich content muc… [+23704 chars]",2026-04-22 13:11:35+00:00,https://make.wordpress.org/core/2026/04/22/whats-new-in-gutenberg-23-0-22-april/,en,['BIRD'],"{'source': {'id': None, 'name': 'Wordpress.org'}, 'author': 'luisherranz', 'title': 'What’s new in Gutenberg 23.0? (22 April)', 'description': '“What’s new in Gutenberg” posts (labeled with the #gutenberg-new tag) are posted following every Gutenberg release on a biweekly basis, showcasing new features included in each release. As a reminder,\xa0here’s an overview\xa0of different ways to keep up with Guten…', 'url': 'https://make.wordpress.org/core/2026/04/22/whats-new-in-gutenberg-23-0-22-april/', 'urlToImage': 'https://make.wordpress.org/core/files/2026/04/revisions-scaled.png', 'publishedAt': '2026-04-22T13:11:35Z', 'content': 'Whats new in GutenbergGutenbergThe Gutenberg project is the new Editor Interface for WordPress. The editor improves the process and experience of creating new content, making writing rich content muc… [+23704 chars]'}",neutral
be0d60f14bcf042030db0972b827f6cfe14f63a6fa1b5aa0afd23a63494d5095,The Week Magazine,AI arms race: are Anthropic and OpenAI handing hackers the ultimate weapon?,"‘Like other tools from the long history of cybersecurity’, the latest models ‘can be used for both offence and defence’","Claims that new AI models can outperform humans at some hacking tasks has sparked widespread alarm about the future of digital security.
Tech firms “usually create buzz around products they plan to … [+3922 chars]",2026-04-22 13:11:18+00:00,https://theweek.com/tech/ai-arms-race-anthropic-openai-hackers-weapon-claude-mythos,en,['BIRD'],"{'source': {'id': None, 'name': 'The Week Magazine'}, 'author': 'theweekonlineeditorsuk@futurenet.com (The Week UK) , The Week UK', 'title': 'AI arms race: are Anthropic and OpenAI handing hackers the ultimate weapon?', 'description': '‘Like other tools from the long history of cybersecurity’, the latest models ‘can be used for both offence and defence’', 'url': 'https://theweek.com/tech/ai-arms-race-anthropic-openai-hackers-weapon-claude-mythos', 'urlToImage': 'https://cdn.mos.cms.futurecdn.net/mEqtLRPmesGfnCt7dgXFr3-2000-80.jpg', 'publishedAt': '2026-04-22T13:11:18Z', 'content': 'Claims that new AI models can outperform humans at some hacking tasks has sparked widespread alarm about the future of digital security.\r\nTech firms “usually create buzz around products they plan to … [+3922 chars]'}",neutral
5908d59dbb320453bb75dcdf142858208df89bd32b1a192bb142c69ee7d84d1a,Pypi.org,ansys-common-mcp added to PyPI,Common Model Context Protocol (MCP) server for PyAnsys libraries,"PyAnsys Common MCP provides the infrastructure for building Model Context Protocol (MCP) servers for PyAnsys libraries.
Overview
This package provides the foundation for creating MCP servers that e… [+1856 chars]",2026-04-22 13:10:50+00:00,https://pypi.org/project/ansys-common-mcp/,en,['BIRD'],"{'source': {'id': None, 'name': 'Pypi.org'}, 'author': 'pyansys.core@ansys.com', 'title': 'ansys-common-mcp added to PyPI', 'description': 'Common Model Context Protocol (MCP) server for PyAnsys libraries', 'url': 'https://pypi.org/project/ansys-common-mcp/', 'urlToImage': 'https://pypi.org/static/images/twitter.abaf4b19.webp', 'publishedAt': '2026-04-22T13:10:50Z', 'content': 'PyAnsys Common MCP provides the infrastructure for building Model Context Protocol (MCP) servers for PyAnsys libraries.\r\nOverview\r\nThis package provides the foundation for creating MCP servers that e… [+1856 chars]'}",positive
