hash,source,title,description,content,published_at,url,language,tickers,raw,weak_label
37696c9c9398bd08a33f460e01c0e2771b7f56d563d91d5b1185449d7cc0b411,Wccftech,"Google Bets On The Agentic AI Era With Its AI Hypercomputer, Merges 8th-Gen TPUs, NVIDIA Rubin, & Axion CPUs Together","Google has announced the AI Hypercomputer, which brings together TPUv8 series, NVIDIA Rubin, & Axion CPUs to power the Agentic AI era. Google Cloud Next 26: AI Hypercomputer Announcement Gives Agentic AI The Next Push, Leverages In-House TPUs, CPUs & Scales B…","Google has announced the AI Hypercomputer, which brings together TPUv8 series, NVIDIA Rubin, &amp; Axion CPUs to power the Agentic AI era.
Gone are the days of supercomputers; the Agentic AI era wil… [+7647 chars]",2026-04-22 13:10:36+00:00,https://wccftech.com/google-unveils-the-heart-of-agentic-ai-the-ai-hypercomputer-8th-gen-tpus-nvidia-rubin-axion-cpus/,en,['BIRD'],"{'source': {'id': None, 'name': 'Wccftech'}, 'author': 'Hassan Mujtaba', 'title': 'Google Bets On The Agentic AI Era With Its AI Hypercomputer, Merges 8th-Gen TPUs, NVIDIA Rubin, & Axion CPUs Together', 'description': 'Google has announced the AI Hypercomputer, which brings together TPUv8 series, NVIDIA Rubin, & Axion CPUs to power the Agentic AI era. Google Cloud Next 26: AI Hypercomputer Announcement Gives Agentic AI The Next Push, Leverages In-House TPUs, CPUs & Scales B…', 'url': 'https://wccftech.com/google-unveils-the-heart-of-agentic-ai-the-ai-hypercomputer-8th-gen-tpus-nvidia-rubin-axion-cpus/', 'urlToImage': 'https://cdn.wccftech.com/wp-content/uploads/2026/04/two_chips_for_the_agentic_era_he.width-2200.format-webp-1920x1083.webp', 'publishedAt': '2026-04-22T13:10:36Z', 'content': 'Google has announced the AI Hypercomputer, which brings together TPUv8 series, NVIDIA Rubin, &amp; Axion CPUs to power the Agentic AI era.\r\nGone are the days of supercomputers; the Agentic AI era wil… [+7647 chars]'}",positive
94f73c98de093a59210f616b2b2e52a93391bae43517cec446b32b2b5062156d,MacRumors,Vision Pro Creator Mike Rockwell Has Considered Leaving Apple,"Mike Rockwell, the Apple executive who led development of the Vision Pro and is now in charge of rebuilding Siri, has considered leaving the company or moving into an advisory role as soon as next year, according to a new Bloomberg report by Mark Gurman.




…","Mike Rockwell, the Apple executive who led development of the Vision Pro and is now in charge of rebuilding Siri, has considered leaving the company or moving into an advisory role as soon as next ye… [+1736 chars]",2026-04-22 13:09:58+00:00,https://www.macrumors.com/2026/04/22/vision-pro-creator-considered-leaving-apple/,en,['BIRD'],"{'source': {'id': None, 'name': 'MacRumors'}, 'author': 'Tim Hardwick', 'title': 'Vision Pro Creator Mike Rockwell Has Considered Leaving Apple', 'description': 'Mike Rockwell, the Apple executive who led development of the Vision Pro and is now in charge of rebuilding Siri, has considered leaving the company or moving into an advisory role as soon as next year, according to a new Bloomberg report by Mark Gurman.\n\n\n\n\n…', 'url': 'https://www.macrumors.com/2026/04/22/vision-pro-creator-considered-leaving-apple/', 'urlToImage': 'https://images.macrumors.com/t/0oV_CZEzUhcV5Q_q8sJ2qo9gG2c=/2500x/article-new/2024/03/apple-vision-pro-orange.jpg', 'publishedAt': '2026-04-22T13:09:58Z', 'content': 'Mike Rockwell, the Apple executive who led development of the Vision Pro and is now in charge of rebuilding Siri, has considered leaving the company or moving into an advisory role as soon as next ye… [+1736 chars]'}",neutral
7afce22de74c32d0912ae36bd7a29bb967926458cf55d53af77e309aa65f0441,New York Post,"Meta workers outraged over internal software tracking keystrokes, mouse movements: ‘How do we opt out?’",Meta employees are fuming over a new internal tool that tracks their clicks and keystrokes — the latest flashpoint in the company’s all-in push on artificial intelligence.,"Meta employees are fuming over a new internal tool that tracks their clicks and keystrokes the latest flashpoint in the companys all-in push on artificial intelligence.
Staffers reacted with alarm a… [+3058 chars]",2026-04-22 13:09:33+00:00,https://nypost.com/2026/04/22/business/meta-workers-outraged-over-software-tracking-keystrokes-mouse-movements/,en,['BIRD'],"{'source': {'id': None, 'name': 'New York Post'}, 'author': 'Ariel Zilber', 'title': 'Meta workers outraged over internal software tracking keystrokes, mouse movements: ‘How do we opt out?’', 'description': 'Meta employees are fuming over a new internal tool that tracks their clicks and keystrokes — the latest flashpoint in the company’s all-in push on artificial intelligence.', 'url': 'https://nypost.com/2026/04/22/business/meta-workers-outraged-over-software-tracking-keystrokes-mouse-movements/', 'urlToImage': 'https://nypost.com/wp-content/uploads/sites/2/2026/04/126157481.jpg?quality=75&strip=all&w=1200', 'publishedAt': '2026-04-22T13:09:33Z', 'content': 'Meta employees are fuming over a new internal tool that tracks their clicks and keystrokes the latest flashpoint in the companys all-in push on artificial intelligence.\r\nStaffers reacted with alarm a… [+3058 chars]'}",negative
c17d78193a5f4ccb822c60aac1b93708a7f4d6434f26683395f6e75fb08be7c1,Gematsu,Gallipoli launches May 21,"Gallipoli, the latest entry in the WWI first-person shooter game series following Isonzo, Tannenberg, and Verdun, will launch for PlayStation 5, Xbox Series, and PC via Steam and Epic Games Store o…","About
What began on mainland Europe, was never likely to end there… Prepare for relentless World War I beach landings and desert warfare across the Middle Eastern Front in Gallipoli!
Faced with the… [+2658 chars]",2026-04-22 13:09:30+00:00,https://www.gematsu.com/2026/04/gallipoli-launches-may-21,en,['BIRD'],"{'source': {'id': None, 'name': 'Gematsu'}, 'author': 'Sal Romano', 'title': 'Gallipoli launches May 21', 'description': 'Gallipoli, the latest entry in the WWI first-person shooter game series following Isonzo, Tannenberg, and Verdun, will launch for PlayStation 5, Xbox Series, and PC via Steam and Epic Games Store o…', 'url': 'https://www.gematsu.com/2026/04/gallipoli-launches-may-21', 'urlToImage': 'https://www.gematsu.com/wp-content/uploads/2026/04/Gallipoli-Date_04-22-26.jpg', 'publishedAt': '2026-04-22T13:09:30Z', 'content': 'About\r\nWhat began on mainland Europe, was never likely to end there… Prepare for relentless World War I beach landings and desert warfare across the Middle Eastern Front in Gallipoli!\r\nFaced with the… [+2658 chars]'}",neutral
4aee1fa688e0ec9344f42dd43309cd870ead81ca92b6a37fe3b846a1701214fe,CBS News,Florida investigates OpenAI over ChatGPT's alleged role in college shooting,"OpenAI and ChatGPT are under investigation by Florida officials after a deadly shooting last year at Florida State University. Prosecutors allege the AI bot offered ""significant advice"" to the suspect just days before the shooting. OpenAI says its chatbot is …",Copyright ©2026 CBS Interactive Inc. All rights reserved.,2026-04-22 13:09:18+00:00,https://www.cbsnews.com/video/florida-investigates-openai-over-chatgpts-alleged-role-in-college-shooting/,en,['BIRD'],"{'source': {'id': 'cbs-news', 'name': 'CBS News'}, 'author': 'CBS News', 'title': ""Florida investigates OpenAI over ChatGPT's alleged role in college shooting"", 'description': 'OpenAI and ChatGPT are under investigation by Florida officials after a deadly shooting last year at Florida State University. Prosecutors allege the AI bot offered ""significant advice"" to the suspect just days before the shooting. OpenAI says its chatbot is …', 'url': 'https://www.cbsnews.com/video/florida-investigates-openai-over-chatgpts-alleged-role-in-college-shooting/', 'urlToImage': 'https://assets1.cbsnewsstatic.com/hub/i/r/2026/04/22/0a76e2b0-9c91-4a4c-8484-eacc166eef7b/thumbnail/1200x630/f704d03665bc2fa8eff896074d46aa7c/cbsn-fusion-florida-investigates-openai-over-chatgpts-alleged-role-in-college-shooting-thumbnail.jpg', 'publishedAt': '2026-04-22T13:09:18Z', 'content': 'Copyright ©2026 CBS Interactive Inc. All rights reserved.'}",neutral
de094876330cfaa3f9c1938fbac62e3f8ae0c213842784c224d87f1280d465f4,Cert.org,VU#518910: Ollama GGUF Quantization Remote Memory Leak,"Overview
Ollama’s model quantization engine contains a vulnerability that allows an attacker with access to the model upload interface to read and potentially exfiltrate heap memory from the server. This issue may lead to unintended behavior, including unauth…","Overview

Ollama’s model quantization engine contains a vulnerability that allows an attacker with access to the model upload interface to read and potentially exfiltrate heap memory from the server… [+3758 chars]",2026-04-22 13:09:16+00:00,https://kb.cert.org/vuls/id/518910,en,['BIRD'],"{'source': {'id': None, 'name': 'Cert.org'}, 'author': None, 'title': 'VU#518910: Ollama GGUF Quantization Remote Memory Leak', 'description': 'Overview\nOllama’s model quantization engine contains a vulnerability that allows an attacker with access to the model upload interface to read and potentially exfiltrate heap memory from the server. This issue may lead to unintended behavior, including unauth…', 'url': 'https://kb.cert.org/vuls/id/518910', 'urlToImage': None, 'publishedAt': '2026-04-22T13:09:16Z', 'content': 'Overview\r\n\nOllama’s model quantization engine contains a vulnerability that allows an attacker with access to the model upload interface to read and potentially exfiltrate heap memory from the server… [+3758 chars]'}",negative
8617874d1e93738c8e2853e0f8b60143ccb38e3f87cfb372cc91d3d92aaec8c7,Paul Tan's Automotive News,"2026 BMW 7 Series facelift – G70 LCI gets Panoramic iDrive, i7 with up to 708 km WLTP range, 250 kW DCFC","It’s only been four years since we first saw the G70 BMW 7 Series, and so radical was the design that it still looks fresh today. Still, that hasn’t stopped Munich from performing a double-quick […]
The post 2026 BMW 7 Series facelift – G70 LCI gets Panoramic…","It’s only been four years since we first saw the G70 BMW 7 Series, and so radical was the design that it still looks fresh today. Still, that hasn’t stopped Munich from performing a double-quick refr… [+9951 chars]",2026-04-22 13:08:22+00:00,https://paultan.org/2026/04/22/2026-bmw-7-series-facelift-g70-lci-gets-panoramic-idrive-i7-with-up-to-708-km-wltp-range-250-kw-dcfc/,en,['BIRD'],"{'source': {'id': None, 'name': ""Paul Tan's Automotive News""}, 'author': 'Jonathan Lee', 'title': '2026 BMW 7 Series facelift – G70 LCI gets Panoramic iDrive, i7 with up to 708 km WLTP range, 250 kW DCFC', 'description': 'It’s only been four years since we first saw the G70 BMW 7 Series, and so radical was the design that it still looks fresh today. Still, that hasn’t stopped Munich from performing a double-quick […]\nThe post 2026 BMW 7 Series facelift – G70 LCI gets Panoramic…', 'url': 'https://paultan.org/2026/04/22/2026-bmw-7-series-facelift-g70-lci-gets-panoramic-idrive-i7-with-up-to-708-km-wltp-range-250-kw-dcfc/', 'urlToImage': 'https://paultan.org/image/2026/04/G70-BMW-7-Series-LCI-preview-2-e1776822253686-1200x677.jpg', 'publishedAt': '2026-04-22T13:08:22Z', 'content': 'It’s only been four years since we first saw the G70 BMW 7 Series, and so radical was the design that it still looks fresh today. Still, that hasn’t stopped Munich from performing a double-quick refr… [+9951 chars]'}",positive
ddbd3f62eba67bb53664a5374623c9f2f70a786ce3bf8d561fcaf5b0fe506f6f,PetaPixel,Airport Says it Will Remove Giant AI Slop Billboard Featuring Fake Photographers,"Manchester Airport in the U.K. says it is removing a photography-themed billboard after it was mocked for being AI slop.
[Read More]","The AI slop billboard in Manchester Airport. | The Lottery Winners
Manchester Airport in the U.K. says it is removing a photography-themed billboard after it was mocked for being AI slop. 
Thom Ryl… [+2011 chars]",2026-04-22 13:08:05+00:00,https://petapixel.com/2026/04/22/airport-says-it-will-remove-giant-ai-slop-billboard-featuring-fake-photographers/,en,['BIRD'],"{'source': {'id': None, 'name': 'PetaPixel'}, 'author': 'Matt Growcoot', 'title': 'Airport Says it Will Remove Giant AI Slop Billboard Featuring Fake Photographers', 'description': 'Manchester Airport in the U.K. says it is removing a photography-themed billboard after it was mocked for being AI slop.\n[Read More]', 'url': 'https://petapixel.com/2026/04/22/airport-says-it-will-remove-giant-ai-slop-billboard-featuring-fake-photographers/', 'urlToImage': 'https://petapixel.com/assets/uploads/2026/04/Manchester-Airport-AI-Billboard.jpg', 'publishedAt': '2026-04-22T13:08:05Z', 'content': 'The AI slop billboard in Manchester Airport. | The Lottery Winners\r\nManchester Airport in the U.K. says it is removing a photography-themed billboard after it was mocked for being AI slop. \r\nThom Ryl… [+2011 chars]'}",negative
e29d657505fb522d77a2c36d8ff36d7bc27b2649cbf00ec250329a90cfda8af7,Pypi.org,clu-cli 1.17.0,Intent-oriented code review for AI-assisted development,"A required part of this site couldnt load. This may be due to a browser
 extension, network issues, or browser settings. Please check your
 connection, disable any ad blockers, or try using a diffe… [+12 chars]",2026-04-22 13:07:14+00:00,https://pypi.org/project/clu-cli/1.17.0/,en,['BIRD'],"{'source': {'id': None, 'name': 'Pypi.org'}, 'author': None, 'title': 'clu-cli 1.17.0', 'description': 'Intent-oriented code review for AI-assisted development', 'url': 'https://pypi.org/project/clu-cli/1.17.0/', 'urlToImage': None, 'publishedAt': '2026-04-22T13:07:14Z', 'content': 'A required part of this site couldnt load. This may be due to a browser\r\n extension, network issues, or browser settings. Please check your\r\n connection, disable any ad blockers, or try using a diffe… [+12 chars]'}",neutral
1c07655c8712cea885fe9adb3cbc6856e9e620165ca8f605899d0c8ed06d1e5a,New Atlas,Review: Wall-hugging RGB laser projector takes entertainment to the Max,"I remember the various iterations of the family TV pretty much always being the focal point of our living room, but it never dominated the space like big flat panels can today. Some of the time the huge flat panel is hypnotizing watchers with the latest block…","I remember the various iterations of the family TV pretty much always being the focal point of our living room, but it never dominated the space like big flat panels can today. Some of the time the h… [+17623 chars]",2026-04-22 13:07:00+00:00,https://newatlas.com/home-entertainment/review-awol-vision-aetherion-max/,en,['BIRD'],"{'source': {'id': None, 'name': 'New Atlas'}, 'author': 'Paul Ridden', 'title': 'Review: Wall-hugging RGB laser projector takes entertainment to the Max', 'description': 'I remember the various iterations of the family TV pretty much always being the focal point of our living room, but it never dominated the space like big flat panels can today. Some of the time the huge flat panel is hypnotizing watchers with the latest block…', 'url': 'https://newatlas.com/home-entertainment/review-awol-vision-aetherion-max/', 'urlToImage': 'https://assets.newatlas.com/dims4/default/f539e22/2147483647/strip/true/crop/6000x3150+0+425/resize/1200x630!/quality/85/?url=https%3A%2F%2Fnewatlas-brightspot.s3.amazonaws.com%2F05%2Fe7%2F6f51a9f44e8287b0e3f6af196339%2Fdsc-7558.JPG&na.image_optimisation=0', 'publishedAt': '2026-04-22T13:07:00Z', 'content': 'I remember the various iterations of the family TV pretty much always being the focal point of our living room, but it never dominated the space like big flat panels can today. Some of the time the h… [+17623 chars]'}",neutral
f322d154499c9638848e47f10de375c3dc2a7c5f9b7ee54ad48d2f6f10d578b3,Battellemedia.com,Your Conversations With AI Are Now On Sale,"Data-driven performance advertising built the modern internet, warts and all. Data has become the most valuable resource in our economy, and the world’s most profitable companies have all organized around enclosing, extracting, processing, refining, and explo…","OpenAI’s early Ads Manager interface, as posted on Search Engine Roundtable.
Data-driven performance advertising built the modern internet, warts and all. Data has become the most valuable resource … [+2672 chars]",2026-04-22 13:06:53+00:00,https://battellemedia.com/archives/2026/04/your-conversations-with-ai-are-now-on-sale,en,['BIRD'],"{'source': {'id': None, 'name': 'Battellemedia.com'}, 'author': 'John Battelle', 'title': 'Your Conversations With AI Are Now On Sale', 'description': 'Data-driven performance advertising built the modern internet, warts and all. Data has become the most valuable resource in our economy, and the world’s most profitable companies have all organized around enclosing, extracting, processing, refining, and explo…', 'url': 'https://battellemedia.com/archives/2026/04/your-conversations-with-ai-are-now-on-sale', 'urlToImage': 'https://battellemedia.com/wp-content/uploads/2026/04/chatgpt-ad-manager-interface-1776778331.gif', 'publishedAt': '2026-04-22T13:06:53Z', 'content': 'OpenAI’s early Ads Manager interface, as posted on Search Engine Roundtable.\r\nData-driven performance advertising built the modern internet, warts and all. Data has become the most valuable resource … [+2672 chars]'}",positive
990b1b7f90200d5f36f13202cc7abb522091fe9374aac7ae6a66e15534aac6c0,Financial Post,"ClickHouse Expands Strategic Collaboration with Google Cloud, Bringing Deeper Integration, Cloud Flexibility, and Next-Generation Performance","SAN FRANCISCO — ClickHouse, a leader in real-time analytics, data warehousing, observability, and AI/ML, today at Google Next 26 announced a significant expansion of its strategic collaboration with Google Cloud. The announcement encompasses four major milest…","SAN FRANCISCO ClickHouse, a leader in real-time analytics, data warehousing, observability, and AI/ML, today at Google Next 26 announced a significant expansion of its strategic collaboration with Go… [+6850 chars]",2026-04-22 13:06:44+00:00,https://financialpost.com/pmn/business-wire-news-releases-pmn/clickhouse-expands-strategic-collaboration-with-google-cloud-bringing-deeper-integration-cloud-flexibility-and-next-generation-performance,en,['BIRD'],"{'source': {'id': 'financial-post', 'name': 'Financial Post'}, 'author': 'Business Wire', 'title': 'ClickHouse Expands Strategic Collaboration with Google Cloud, Bringing Deeper Integration, Cloud Flexibility, and Next-Generation Performance', 'description': 'SAN FRANCISCO — ClickHouse, a leader in real-time analytics, data warehousing, observability, and AI/ML, today at Google Next 26 announced a significant expansion of its strategic collaboration with Google Cloud. The announcement encompasses four major milest…', 'url': 'https://financialpost.com/pmn/business-wire-news-releases-pmn/clickhouse-expands-strategic-collaboration-with-google-cloud-bringing-deeper-integration-cloud-flexibility-and-next-generation-performance', 'urlToImage': None, 'publishedAt': '2026-04-22T13:06:44Z', 'content': 'SAN FRANCISCO ClickHouse, a leader in real-time analytics, data warehousing, observability, and AI/ML, today at Google Next 26 announced a significant expansion of its strategic collaboration with Go… [+6850 chars]'}",positive
e57c7a7ca090d8c90b9ef5d65388e987ab8084fcbadfd4ead1783283a1e9dc96,Financial Post,I/ONX Shatters the Host Tax: New Symphony SixtyFour Architecture Delivers 50% TCO Savings Across AI Inference and Fine-Tuning Lifecycle,"Eliminating infrastructure overhead of legacy designs, I/ONX debuts a scaled AI inference and fine-tuning stack that cuts power by up to 30kW per rack and reduces cost of rack-scale deployments by up to 70% LAS VEGAS — I/ONX High Performance Compute (HPC), a …","Eliminating infrastructure overhead of legacy designs, I/ONX debuts a scaled AI inference and fine-tuning stack that cuts power by up to 30kW per rack and reduces cost of rack-scale deployments by up… [+6499 chars]",2026-04-22 13:06:35+00:00,https://financialpost.com/pmn/business-wire-news-releases-pmn/i-onx-shatters-the-host-tax-new-symphony-sixtyfour-architecture-delivers-50-tco-savings-across-ai-inference-and-fine-tuning-lifecycle,en,['BIRD'],"{'source': {'id': 'financial-post', 'name': 'Financial Post'}, 'author': 'Business Wire', 'title': 'I/ONX Shatters the Host Tax: New Symphony SixtyFour Architecture Delivers 50% TCO Savings Across AI Inference and Fine-Tuning Lifecycle', 'description': 'Eliminating infrastructure overhead of legacy designs, I/ONX debuts a scaled AI inference and fine-tuning stack that cuts power by up to 30kW per rack and reduces cost of rack-scale deployments by up to 70% LAS VEGAS — I/ONX High Performance Compute (HPC), a …', 'url': 'https://financialpost.com/pmn/business-wire-news-releases-pmn/i-onx-shatters-the-host-tax-new-symphony-sixtyfour-architecture-delivers-50-tco-savings-across-ai-inference-and-fine-tuning-lifecycle', 'urlToImage': 'https://smartcdn.gprod.postmedia.digital/financialpost/wp-content/uploads/2026/04/bw20260422485327_host_tax.jpeg', 'publishedAt': '2026-04-22T13:06:35Z', 'content': 'Eliminating infrastructure overhead of legacy designs, I/ONX debuts a scaled AI inference and fine-tuning stack that cuts power by up to 30kW per rack and reduces cost of rack-scale deployments by up… [+6499 chars]'}",positive
434952a49f8a509417b4150d47980c787c2eb38881bac56637810819d534d150,Financial Post,"Snowflake Makes AI Real for Businesses at Snowflake Summit 26, Featuring Anthropic’s Daniela Amodei and Other Industry Leaders","Snowflake will host its biggest and boldest user conference to date, including a keynote discussion with Anthropic’s Co-Founder and President Daniela Amodei, 500+ sessions, 200+ on-site partners, and new AI-powered immersive event experiences Anthropic Co-Fou…","At Snowflake Summit 26, Snowflake will demonstrate how organizations are moving from experimentation to real results with data, bringing insights into everyday decisions and business impact. Join Sno… [+2194 chars]",2026-04-22 13:06:22+00:00,https://financialpost.com/pmn/business-wire-news-releases-pmn/snowflake-makes-ai-real-for-businesses-at-snowflake-summit-26-featuring-anthropics-daniela-amodei-and-other-industry-leaders,en,['BIRD'],"{'source': {'id': 'financial-post', 'name': 'Financial Post'}, 'author': 'Business Wire', 'title': 'Snowflake Makes AI Real for Businesses at Snowflake Summit 26, Featuring Anthropic’s Daniela Amodei and Other Industry Leaders', 'description': 'Snowflake will host its biggest and boldest user conference to date, including a keynote discussion with Anthropic’s Co-Founder and President Daniela Amodei, 500+ sessions, 200+ on-site partners, and new AI-powered immersive event experiences Anthropic Co-Fou…', 'url': 'https://financialpost.com/pmn/business-wire-news-releases-pmn/snowflake-makes-ai-real-for-businesses-at-snowflake-summit-26-featuring-anthropics-daniela-amodei-and-other-industry-leaders', 'urlToImage': 'https://smartcdn.gprod.postmedia.digital/financialpost/wp-content/uploads/2026/04/bw20260422291081_snowflake_makes_ai_real_for_businesses_at_s.jpeg', 'publishedAt': '2026-04-22T13:06:22Z', 'content': 'At Snowflake Summit 26, Snowflake will demonstrate how organizations are moving from experimentation to real results with data, bringing insights into everyday decisions and business impact. Join Sno… [+2194 chars]'}",positive
1f88c1ad1fc05d04a0c0f51a5f95687088aaf1803632ba1b5972a26c9c3e57f4,Financial Post,Advisor360° Introduces Financial Planning to Enhance the Advisor Experience,"NEEDHAM, Mass. & WINNIPEG, Manitoba — Advisor360°TM, the AI-native operating system for the advisor experience, and Conquest Planning, a technology platform modernizing financial planning with customized advice across the wealth spectrum, today announced a ne…","NEEDHAM, Mass. &amp; WINNIPEG, Manitoba Advisor360°TM, the AI-native operating system for the advisor experience, and Conquest Planning, a technology platform modernizing financial planning with cust… [+7824 chars]",2026-04-22 13:06:10+00:00,https://financialpost.com/pmn/business-wire-news-releases-pmn/advisor360-introduces-financial-planning-to-enhance-the-advisor-experience,en,['BIRD'],"{'source': {'id': 'financial-post', 'name': 'Financial Post'}, 'author': 'Business Wire', 'title': 'Advisor360° Introduces Financial Planning to Enhance the Advisor Experience', 'description': 'NEEDHAM, Mass. & WINNIPEG, Manitoba — Advisor360°TM, the AI-native operating system for the advisor experience, and Conquest Planning, a technology platform modernizing financial planning with customized advice across the wealth spectrum, today announced a ne…', 'url': 'https://financialpost.com/pmn/business-wire-news-releases-pmn/advisor360-introduces-financial-planning-to-enhance-the-advisor-experience', 'urlToImage': None, 'publishedAt': '2026-04-22T13:06:10Z', 'content': 'NEEDHAM, Mass. &amp; WINNIPEG, Manitoba Advisor360°TM, the AI-native operating system for the advisor experience, and Conquest Planning, a technology platform modernizing financial planning with cust… [+7824 chars]'}",positive
