hash,source,title,description,content,published_at,url,language,tickers,raw,weak_label
ce1facca9a9d708249426e29270f64e304aa10e80e5a1058adc5d7d1867e33bf,Pypi.org,quartermaster-sdk 0.4.5,Quartermaster — modular AI agent orchestration framework. Install this to get all packages.,"A required part of this site couldnt load. This may be due to a browser
 extension, network issues, or browser settings. Please check your
 connection, disable any ad blockers, or try using a diffe… [+12 chars]",2026-04-22 13:28:47+00:00,https://pypi.org/project/quartermaster-sdk/0.4.5/,en,['BIRD'],"{'source': {'id': None, 'name': 'Pypi.org'}, 'author': 'info@mindmade.io', 'title': 'quartermaster-sdk 0.4.5', 'description': 'Quartermaster — modular AI agent orchestration framework. Install this to get all packages.', 'url': 'https://pypi.org/project/quartermaster-sdk/0.4.5/', 'urlToImage': None, 'publishedAt': '2026-04-22T13:28:47Z', 'content': 'A required part of this site couldnt load. This may be due to a browser\r\n extension, network issues, or browser settings. Please check your\r\n connection, disable any ad blockers, or try using a diffe… [+12 chars]'}",neutral
7987f1223778bce06945ab969579d143db7e576c090b9c7519346bf04b1fc14e,Pypi.org,quartermaster-engine 0.4.5,"Execution engine for AI agent graphs — traversal, branching, merging, memory, message passing, and error handling","A required part of this site couldnt load. This may be due to a browser
 extension, network issues, or browser settings. Please check your
 connection, disable any ad blockers, or try using a diffe… [+12 chars]",2026-04-22 13:28:39+00:00,https://pypi.org/project/quartermaster-engine/0.4.5/,en,['BIRD'],"{'source': {'id': None, 'name': 'Pypi.org'}, 'author': 'info@mindmade.io', 'title': 'quartermaster-engine 0.4.5', 'description': 'Execution engine for AI agent graphs — traversal, branching, merging, memory, message passing, and error handling', 'url': 'https://pypi.org/project/quartermaster-engine/0.4.5/', 'urlToImage': None, 'publishedAt': '2026-04-22T13:28:39Z', 'content': 'A required part of this site couldnt load. This may be due to a browser\r\n extension, network issues, or browser settings. Please check your\r\n connection, disable any ad blockers, or try using a diffe… [+12 chars]'}",neutral
d84b7fbf1378a4d8ea4f62cd061ec7a436c5ddfcadd2381545bc04da98603946,Pypi.org,quartermaster-nodes 0.4.5,Library of composable node types for building AI agent graphs,"A required part of this site couldnt load. This may be due to a browser
 extension, network issues, or browser settings. Please check your
 connection, disable any ad blockers, or try using a diffe… [+12 chars]",2026-04-22 13:28:36+00:00,https://pypi.org/project/quartermaster-nodes/0.4.5/,en,['BIRD'],"{'source': {'id': None, 'name': 'Pypi.org'}, 'author': 'info@mindmade.io', 'title': 'quartermaster-nodes 0.4.5', 'description': 'Library of composable node types for building AI agent graphs', 'url': 'https://pypi.org/project/quartermaster-nodes/0.4.5/', 'urlToImage': None, 'publishedAt': '2026-04-22T13:28:36Z', 'content': 'A required part of this site couldnt load. This may be due to a browser\r\n extension, network issues, or browser settings. Please check your\r\n connection, disable any ad blockers, or try using a diffe… [+12 chars]'}",neutral
371f64779c481bb9d2996f437a2fc4f7b1bd4d63ccb4c11d006dfb65eaa91601,Pypi.org,quartermaster-tools 0.4.5,Tool abstraction framework and chain-of-responsibility handler pattern for AI agent orchestration,"A required part of this site couldnt load. This may be due to a browser
 extension, network issues, or browser settings. Please check your
 connection, disable any ad blockers, or try using a diffe… [+12 chars]",2026-04-22 13:28:33+00:00,https://pypi.org/project/quartermaster-tools/0.4.5/,en,['BIRD'],"{'source': {'id': None, 'name': 'Pypi.org'}, 'author': 'info@mindmade.io', 'title': 'quartermaster-tools 0.4.5', 'description': 'Tool abstraction framework and chain-of-responsibility handler pattern for AI agent orchestration', 'url': 'https://pypi.org/project/quartermaster-tools/0.4.5/', 'urlToImage': None, 'publishedAt': '2026-04-22T13:28:33Z', 'content': 'A required part of this site couldnt load. This may be due to a browser\r\n extension, network issues, or browser settings. Please check your\r\n connection, disable any ad blockers, or try using a diffe… [+12 chars]'}",neutral
ddba91648d1a4bb242bafc75275f835dde962aa6afa163a66fc72e73946e035b,Pypi.org,quartermaster-graph 0.4.5,Framework-agnostic agent graph schema for AI agent workflows as directed acyclic graphs,"A required part of this site couldnt load. This may be due to a browser
 extension, network issues, or browser settings. Please check your
 connection, disable any ad blockers, or try using a diffe… [+12 chars]",2026-04-22 13:28:31+00:00,https://pypi.org/project/quartermaster-graph/0.4.5/,en,['BIRD'],"{'source': {'id': None, 'name': 'Pypi.org'}, 'author': 'info@mindmade.io', 'title': 'quartermaster-graph 0.4.5', 'description': 'Framework-agnostic agent graph schema for AI agent workflows as directed acyclic graphs', 'url': 'https://pypi.org/project/quartermaster-graph/0.4.5/', 'urlToImage': None, 'publishedAt': '2026-04-22T13:28:31Z', 'content': 'A required part of this site couldnt load. This may be due to a browser\r\n extension, network issues, or browser settings. Please check your\r\n connection, disable any ad blockers, or try using a diffe… [+12 chars]'}",neutral
2f07fea5adabbfb15b0879d9b09f627c125b9abd7af73cc203e2ed7c03eab0b4,Pypi.org,pymahjong 1.1.0,A Japanese Mahjong environment for decision AI research.,"A required part of this site couldnt load. This may be due to a browser
 extension, network issues, or browser settings. Please check your
 connection, disable any ad blockers, or try using a diffe… [+12 chars]",2026-04-22 13:28:29+00:00,https://pypi.org/project/pymahjong/1.1.0/,en,['BIRD'],"{'source': {'id': None, 'name': 'Pypi.org'}, 'author': 'chenzhaoyun@iai.ustc.edu.cn', 'title': 'pymahjong 1.1.0', 'description': 'A Japanese Mahjong environment for decision AI research.', 'url': 'https://pypi.org/project/pymahjong/1.1.0/', 'urlToImage': None, 'publishedAt': '2026-04-22T13:28:29Z', 'content': 'A required part of this site couldnt load. This may be due to a browser\r\n extension, network issues, or browser settings. Please check your\r\n connection, disable any ad blockers, or try using a diffe… [+12 chars]'}",neutral
fbacccaddaa6cbf6fd6614d4ef4aba2c17c350ef043a217a0ba12d3f96a17d46,BusinessLine,Redwood Software sets up global tech centre,"The center was inaugurated by Phani Nagarjuna, Founding Chief Executive Officer of Aikam (Telangana AI Innovation Hub), Kevin Greene, Chief Executive Officer, Redwood, Rajkumar Paulraj, Vice-President of Engineering and India Country Head, Redwood India","Redwood Software, a US-based orchestration platform for the autonomous enterprise, has inaugurated its global centre in India, choosing Hyderabad as its primary operational location. The 30,000 sft f… [+837 chars]",2026-04-22 13:28:12+00:00,https://www.thehindubusinessline.com/companies/redwood-software-sets-up-global-tech-centre/article70893060.ece,en,['BIRD'],"{'source': {'id': None, 'name': 'BusinessLine'}, 'author': 'BL Hyderabad Bureau', 'title': 'Redwood Software sets up global tech centre', 'description': 'The center was inaugurated by Phani Nagarjuna, Founding Chief Executive Officer of Aikam (Telangana AI Innovation Hub), Kevin Greene, Chief Executive Officer, Redwood, Rajkumar Paulraj, Vice-President of Engineering and India Country Head, Redwood India', 'url': 'https://www.thehindubusinessline.com/companies/redwood-software-sets-up-global-tech-centre/article70893060.ece', 'urlToImage': 'https://bl-i.thgim.com/public/incoming/4lf9ud/article70893139.ece/alternates/LANDSCAPE_1200/IMG_iStock-2214024616_2_1_HMFS1GKK.jpg', 'publishedAt': '2026-04-22T13:28:12Z', 'content': 'Redwood Software, a US-based orchestration platform for the autonomous enterprise, has inaugurated its global centre in India, choosing Hyderabad as its primary operational location. The 30,000 sft f… [+837 chars]'}",neutral
4171d5609b6de4624c61647e81c917374a038d21c4784fa91cfa127c43eb1c11,Quartz India,Robinhood venture fund buys $75 million stake in OpenAI,"Robinhood Ventures Fund I, which began trading on the NYSE in March, now holds a stake in the AI company alongside Databricks, Revolut, and Stripe","Robinhood Ventures Fund I purchased about $75 million of OpenAI common stock on April 17, the fund announced April 22.
The fund, which trades on the New York Stock Exchange under the ticker RVI, is … [+1812 chars]",2026-04-22 13:27:34+00:00,https://qz.com/robinhoods-retail-venture-fund-bought-75-million-of-openai-stock,en,['BIRD'],"{'source': {'id': None, 'name': 'Quartz India'}, 'author': 'Colleen Cabili', 'title': 'Robinhood venture fund buys $75 million stake in OpenAI', 'description': 'Robinhood Ventures Fund I, which began trading on the NYSE in March, now holds a stake in the AI company alongside Databricks, Revolut, and Stripe', 'url': 'https://qz.com/robinhoods-retail-venture-fund-bought-75-million-of-openai-stock', 'urlToImage': 'https://s.yimg.com/ny/api/res/1.2/DCZspRW1ZsPF07vmCA8lkQ--/YXBwaWQ9aGlnaGxhbmRlcjt3PTEyMDA7aD02NzU-/https://media.zenfs.com/en/quartz_855/449c4be9f506a4a370807e7b25f63996', 'publishedAt': '2026-04-22T13:27:34Z', 'content': 'Robinhood Ventures Fund I purchased about $75 million of OpenAI common stock on April 17, the fund announced April 22.\r\nThe fund, which trades on the New York Stock Exchange under the ticker RVI, is … [+1812 chars]'}",neutral
ee0aa1f3ea431801c2a30da9a0382e498e0513ed9fc707f35a576932f3b2b3c2,CryptoSlate,Will new Apple CEO combat fake crypto apps littering the “walled garden” App Store?,"Apple is heading into its biggest leadership transition in years, just as scrutiny is mounting over the security of its App Store and the rise of crypto theft on iPhones. On April 20, the company revealed that John Ternus, its senior vice president of hardwar…","Apple is heading into its biggest leadership transition in years, just as scrutiny is mounting over the security of its App Store and the rise of crypto theft on iPhones.
On April 20, the company re… [+6654 chars]",2026-04-22 13:26:57+00:00,https://cryptoslate.com/will-apple-new-ceo-combat-fake-crypto-apps-littering-the-walled-garden-app-store/,en,['BIRD'],"{'source': {'id': None, 'name': 'CryptoSlate'}, 'author': 'Oluwapelumi Adejumo', 'title': 'Will new Apple CEO combat fake crypto apps littering the “walled garden” App Store?', 'description': 'Apple is heading into its biggest leadership transition in years, just as scrutiny is mounting over the security of its App Store and the rise of crypto theft on iPhones. On April 20, the company revealed that John Ternus, its senior vice president of hardwar…', 'url': 'https://cryptoslate.com/will-apple-new-ceo-combat-fake-crypto-apps-littering-the-walled-garden-app-store/', 'urlToImage': 'https://cryptoslate.com/wp-content/uploads/2026/04/appstore-fake-apps.webp', 'publishedAt': '2026-04-22T13:26:57Z', 'content': 'Apple is heading into its biggest leadership transition in years, just as scrutiny is mounting over the security of its App Store and the rise of crypto theft on iPhones.\r\nOn April 20, the company re… [+6654 chars]'}",neutral
009ef24d26d1064a33043daec3f82894a5a3c1d37ee8c1bf7eb8132966169f56,Livemint,Tech Mahindra rebounds from a two-year revenue decline,"India’s fifth-largest IT services company saw nearly 2% growth in FY26 revenue to $6.39 billion, beating street expectations.","Tech Mahindra Ltd reversed a two-year revenue decline in 2025-26 despite demand uncertainty weighing on Indias $297-billion information technology (IT) services sector, as it entered the final leg of… [+3970 chars]",2026-04-22 13:26:28+00:00,https://www.livemint.com/companies/company-results/tech-mahindra-revenue-growth-profit-turnaround-it-sector-india-results-hcl-infosys-tcs-11776859269018.html,en,['BIRD'],"{'source': {'id': None, 'name': 'Livemint'}, 'author': 'Jas Bardia', 'title': 'Tech Mahindra rebounds from a two-year revenue decline', 'description': 'India’s fifth-largest IT services company saw nearly 2% growth in FY26 revenue to $6.39 billion, beating street expectations.', 'url': 'https://www.livemint.com/companies/company-results/tech-mahindra-revenue-growth-profit-turnaround-it-sector-india-results-hcl-infosys-tcs-11776859269018.html', 'urlToImage': 'https://www.livemint.com/lm-img/img/2026/04/22/1600x900/logo/TECH-MAHINDRA-RESULTS--0_1706092761514_1776863522355.JPG', 'publishedAt': '2026-04-22T13:26:28Z', 'content': 'Tech Mahindra Ltd reversed a two-year revenue decline in 2025-26 despite demand uncertainty weighing on Indias $297-billion information technology (IT) services sector, as it entered the final leg of… [+3970 chars]'}",positive
0bd090d697eb8c37f8109230def0a1139d2a8e0988c2da263a10e416c76d2fb9,GlobeNewswire,Questex’s Sensors Converge 2026 Expo Floor Nearly Sold Out as Event Momentum Accelerates,"90% of Exhibit Space Secured, 50+ New Exhibitors and Leading Technology Companies Join North America’s Premier Sensors Event 90% of Exhibit Space Secured, 50+ New Exhibitors and Leading Technology Companies Join North America’s Premier Sensors Event","SANTA CLARA, Calif., April 22, 2026 (GLOBE NEWSWIRE) -- Questexs Sensors Converge, North Americas leading event focused exclusively on sensors and sensing technologies, today announces its 2026 expo … [+5913 chars]",2026-04-22 13:26:00+00:00,https://www.globenewswire.com/news-release/2026/04/22/3279069/0/en/Questex-s-Sensors-Converge-2026-Expo-Floor-Nearly-Sold-Out-as-Event-Momentum-Accelerates.html,en,['BIRD'],"{'source': {'id': None, 'name': 'GlobeNewswire'}, 'author': 'Questex LLC', 'title': 'Questex’s Sensors Converge 2026 Expo Floor Nearly Sold Out as Event Momentum Accelerates', 'description': '90% of Exhibit Space Secured, 50+ New Exhibitors and Leading Technology Companies Join North America’s Premier Sensors Event 90% of Exhibit Space Secured, 50+ New Exhibitors and Leading Technology Companies Join North America’s Premier Sensors Event', 'url': 'https://www.globenewswire.com/news-release/2026/04/22/3279069/0/en/Questex-s-Sensors-Converge-2026-Expo-Floor-Nearly-Sold-Out-as-Event-Momentum-Accelerates.html', 'urlToImage': 'https://ml.globenewswire.com/Resource/Download/8cf9fd8b-3ce6-4c32-8db4-ee3fb14b37f3', 'publishedAt': '2026-04-22T13:26:00Z', 'content': 'SANTA CLARA, Calif., April 22, 2026 (GLOBE NEWSWIRE) -- Questexs\xa0Sensors Converge, North Americas leading event focused exclusively on sensors and sensing technologies, today announces its 2026 expo … [+5913 chars]'}",positive
79b1b98190ffae9de73612f8f72cce373dcab4798e21b46db11c5c8b93189f36,Pypi.org,agentberlin 0.80.0,Python SDK for Agent Berlin - AI-powered SEO and AEO automation,"A required part of this site couldnt load. This may be due to a browser
 extension, network issues, or browser settings. Please check your
 connection, disable any ad blockers, or try using a diffe… [+12 chars]",2026-04-22 13:24:42+00:00,https://pypi.org/project/agentberlin/0.80.0/,en,['BIRD'],"{'source': {'id': None, 'name': 'Pypi.org'}, 'author': 'support@agentberlin.ai', 'title': 'agentberlin 0.80.0', 'description': 'Python SDK for Agent Berlin - AI-powered SEO and AEO automation', 'url': 'https://pypi.org/project/agentberlin/0.80.0/', 'urlToImage': None, 'publishedAt': '2026-04-22T13:24:42Z', 'content': 'A required part of this site couldnt load. This may be due to a browser\r\n extension, network issues, or browser settings. Please check your\r\n connection, disable any ad blockers, or try using a diffe… [+12 chars]'}",neutral
74a0ebd07bdd28f78608c7cc1f5d1ffe19f2b48afe13eaaa89a45f8e589c88ab,Substack.com,The joy of not monetizing your art,Resisting turning a hobby into a jobby. Does money kill the joy of making art?,"Its interesting how, even unintentionally, the way you are publicly perceived is shaped by the persona you project online, even if its misaligned with how you see yourself. Because I started posting … [+10912 chars]",2026-04-22 13:24:10+00:00,https://jennapark.substack.com/p/the-joy-of-not-monetizing-your-art,en,['BIRD'],"{'source': {'id': None, 'name': 'Substack.com'}, 'author': 'Jenna Park', 'title': 'The joy of not monetizing your art', 'description': 'Resisting turning a hobby into a jobby. Does money kill the joy of making art?', 'url': 'https://jennapark.substack.com/p/the-joy-of-not-monetizing-your-art', 'urlToImage': 'https://substackcdn.com/image/fetch/$s_!shBX!,w_1200,h_675,c_fill,f_jpg,q_auto:good,fl_progressive:steep,g_auto/https%3A%2F%2Fsubstack-post-media.s3.amazonaws.com%2Fpublic%2Fimages%2F0d0e51c9-3d0b-4599-ad7d-8f89b445f686_1200x630.jpeg', 'publishedAt': '2026-04-22T13:24:10Z', 'content': 'Its interesting how, even unintentionally, the way you are publicly perceived is shaped by the persona you project online, even if its misaligned with how you see yourself. Because I started posting … [+10912 chars]'}",neutral
35ded7e10d2681cadab51032739e32e1fd7057ce2be946d75d967ad4ed7e57e2,Help Net Security,Acronis GenAI Protection gives MSPs control over AI usage and data risks,"Acronis has launced Acronis GenAI Protection, a monitoring and security solution that enables managed service providers (MSPs) to control generative AI usage across client environments, preventing sensitive data exposure and protecting against malicious promp…","Acronis has launced Acronis GenAI Protection, a monitoring and security solution that enables managed service providers (MSPs) to control generative AI usage across client environments, preventing se… [+3089 chars]",2026-04-22 13:24:08+00:00,https://www.helpnetsecurity.com/2026/04/22/acronis-genai-protection/,en,['BIRD'],"{'source': {'id': None, 'name': 'Help Net Security'}, 'author': 'Industry News', 'title': 'Acronis GenAI Protection gives MSPs control over AI usage and data risks', 'description': 'Acronis has launced Acronis GenAI Protection, a monitoring and security solution that enables managed service providers (MSPs) to control generative AI usage across client environments, preventing sensitive data exposure and protecting against malicious promp…', 'url': 'https://www.helpnetsecurity.com/2026/04/22/acronis-genai-protection/', 'urlToImage': 'https://img.helpnetsecurity.com/wp-content/uploads/2024/11/28150559/hns-large_logo.webp', 'publishedAt': '2026-04-22T13:24:08Z', 'content': 'Acronis has launced Acronis GenAI Protection, a monitoring and security solution that enables managed service providers (MSPs) to control generative AI usage across client environments, preventing se… [+3089 chars]'}",positive
d074c10691b0ee657cb2678c84ce2ae1ac587ddeee75b4df673d633c6bea1e29,Time Out,"This east London walk uncovers some of the capital’s weirdest secrets – with burial grounds, occultists and the ‘Mole House’",Comedian Stewart Lee shares a Weird Walk in De Beauvoir,"From stone circles to leylines, to legends and witchcraft, the UK is packed full of freaky and mysterious histories and mythologies, which according to the folk at Weird Walk – the zine that encourag… [+3809 chars]",2026-04-22 13:23:58+00:00,https://www.timeout.com/london/news/this-east-london-walk-uncovers-some-of-the-capitals-weirdest-secrets-with-burial-grounds-occultists-and-the-mole-house-042226,en,['BIRD'],"{'source': {'id': None, 'name': 'Time Out'}, 'author': 'Primary Author: Stewart Lee', 'title': 'This east London walk uncovers some of the capital’s weirdest secrets – with burial grounds, occultists and the ‘Mole House’', 'description': 'Comedian Stewart Lee shares a Weird Walk in De Beauvoir', 'url': 'https://www.timeout.com/london/news/this-east-london-walk-uncovers-some-of-the-capitals-weirdest-secrets-with-burial-grounds-occultists-and-the-mole-house-042226', 'urlToImage': 'https://media.timeout.com/images/106397111/image.jpg', 'publishedAt': '2026-04-22T13:23:58Z', 'content': 'From stone circles to leylines, to legends and witchcraft, the UK is packed full of freaky and mysterious histories and mythologies, which according to the folk at Weird Walk\xa0– the zine that encourag… [+3809 chars]'}",neutral
57626d19754cdbe6690eeab569af0c40a88d3720df504ef5817cd5ae0d1df769,Pypi.org,json-memory 1.9.1,"Hierarchical associative memory for AI agents — compress, structure, and navigate agent memory like a human brain","A required part of this site couldnt load. This may be due to a browser
 extension, network issues, or browser settings. Please check your
 connection, disable any ad blockers, or try using a diffe… [+12 chars]",2026-04-22 13:22:13+00:00,https://pypi.org/project/json-memory/1.9.1/,en,['BIRD'],"{'source': {'id': None, 'name': 'Pypi.org'}, 'author': 'dion.christiann@gmail.com', 'title': 'json-memory 1.9.1', 'description': 'Hierarchical associative memory for AI agents — compress, structure, and navigate agent memory like a human brain', 'url': 'https://pypi.org/project/json-memory/1.9.1/', 'urlToImage': None, 'publishedAt': '2026-04-22T13:22:13Z', 'content': 'A required part of this site couldnt load. This may be due to a browser\r\n extension, network issues, or browser settings. Please check your\r\n connection, disable any ad blockers, or try using a diffe… [+12 chars]'}",neutral
cc8c6f3082d3098e1ed61056ebc2e474df9fe17c2aadece845336364b499a8f3,The Daily Caller,Trump Hated Deep State Spying Powers Used Against Him. Then He Launched A War,President Trump spent years railing against government surveillance powers until military ambitions in the Middle East changed his tune.,"President Donald Trump spent years railing against government surveillance powers that were weaponized against him — until military ambitions in the Middle East changed his tune.
The president is pu… [+10311 chars]",2026-04-22 13:21:46+00:00,https://dailycaller.com/2026/04/22/trump-deep-state-spying-fisa-iran-war-foreign-intelligence/,en,['BIRD'],"{'source': {'id': None, 'name': 'The Daily Caller'}, 'author': 'Hudson Crozier', 'title': 'Trump Hated Deep State Spying Powers Used Against Him. Then He Launched A War', 'description': 'President Trump spent years railing against government surveillance powers until military ambitions in the Middle East changed his tune.', 'url': 'https://dailycaller.com/2026/04/22/trump-deep-state-spying-fisa-iran-war-foreign-intelligence/', 'urlToImage': 'https://images.dailycaller.com/image/width=1280,height=549,fit=cover,format=webp,f=auto/https://cdn01.dailycaller.com/wp-content/uploads/2026/04/GettyImages-2270097260-scaled-e1776286331818.jpg', 'publishedAt': '2026-04-22T13:21:46Z', 'content': 'President Donald Trump spent years railing against government surveillance powers that were weaponized against him — until military ambitions in the Middle East changed his tune.\r\nThe president is pu… [+10311 chars]'}",negative
d8b52321236f7d94991acad85726e29463e0299589359a286c962e5f3d217942,Celebitchy.com,Sykes: Footage of Duchess Meghan looking at a staffer proves that she’s a bully,"Last year, something really revealing happened because of the Duchess of Sussex’s With Love, Meghan series. In the first season, Meghan hosted Mindy Kaling as a guest, and on camera, Mindy called Meghan by her maiden name. Meghan gently corrected her, saying …","Last year, something really revealing happened because of the Duchess of Sussexs With Love, Meghan series. In the first season, Meghan hosted Mindy Kaling as a guest, and on camera, Mindy called Megh… [+8132 chars]",2026-04-22 13:20:53+00:00,https://www.celebitchy.com/973236/sykes_footage_of_duchess_meghan_looking_at_a_staffer_proves_that_shes_a_bully/,en,['BIRD'],"{'source': {'id': None, 'name': 'Celebitchy.com'}, 'author': 'Kaiser', 'title': 'Sykes: Footage of Duchess Meghan looking at a staffer proves that she’s a bully', 'description': 'Last year, something really revealing happened because of the Duchess of Sussex’s With Love, Meghan series. In the first season, Meghan hosted Mindy Kaling as a guest, and on camera, Mindy called Meghan by her maiden name. Meghan gently corrected her, saying …', 'url': 'https://www.celebitchy.com/973236/sykes_footage_of_duchess_meghan_looking_at_a_staffer_proves_that_shes_a_bully/', 'urlToImage': 'https://www.celebitchy.com/wp-content/uploads/2026/04/coverimages55614984-8.jpg', 'publishedAt': '2026-04-22T13:20:53Z', 'content': 'Last year, something really revealing happened because of the Duchess of Sussexs With Love, Meghan series. In the first season, Meghan hosted Mindy Kaling as a guest, and on camera, Mindy called Megh… [+8132 chars]'}",neutral
